-- phpMyAdmin SQL Dump
-- version 5.0.4
-- https://www.phpmyadmin.net/
--
-- Host: 127.0.0.1
-- Generation Time: Mar 18, 2021 at 04:19 PM
-- Server version: 10.4.11-MariaDB
-- PHP Version: 7.4.2

SET SQL_MODE = "NO_AUTO_VALUE_ON_ZERO";
START TRANSACTION;
SET time_zone = "+00:00";


/*!40101 SET @OLD_CHARACTER_SET_CLIENT=@@CHARACTER_SET_CLIENT */;
/*!40101 SET @OLD_CHARACTER_SET_RESULTS=@@CHARACTER_SET_RESULTS */;
/*!40101 SET @OLD_COLLATION_CONNECTION=@@COLLATION_CONNECTION */;
/*!40101 SET NAMES utf8mb4 */;

--
-- Database: `bariwala`
--

-- --------------------------------------------------------

--
-- Table structure for table `admins`
--

CREATE TABLE `admins` (
  `id` bigint(20) UNSIGNED NOT NULL,
  `name` varchar(191) COLLATE utf8mb4_unicode_ci NOT NULL,
  `phone` varchar(191) COLLATE utf8mb4_unicode_ci DEFAULT NULL,
  `email` varchar(191) COLLATE utf8mb4_unicode_ci NOT NULL,
  `email_verified_at` timestamp NULL DEFAULT NULL,
  `password` varchar(191) COLLATE utf8mb4_unicode_ci NOT NULL,
  `remember_token` varchar(100) COLLATE utf8mb4_unicode_ci DEFAULT NULL,
  `places` varchar(11) COLLATE utf8mb4_unicode_ci DEFAULT NULL,
  `all_properties` varchar(11) COLLATE utf8mb4_unicode_ci DEFAULT NULL,
  `orders` varchar(11) COLLATE utf8mb4_unicode_ci DEFAULT NULL,
  `newsletter` varchar(11) COLLATE utf8mb4_unicode_ci DEFAULT NULL,
  `contact_messages` varchar(11) COLLATE utf8mb4_unicode_ci DEFAULT NULL,
  `site_setting` varchar(11) COLLATE utf8mb4_unicode_ci DEFAULT NULL,
  `type` varchar(11) COLLATE utf8mb4_unicode_ci DEFAULT NULL,
  `created_at` timestamp NULL DEFAULT current_timestamp(),
  `updated_at` timestamp NULL DEFAULT current_timestamp()
) ENGINE=InnoDB DEFAULT CHARSET=utf8mb4 COLLATE=utf8mb4_unicode_ci;

--
-- Dumping data for table `admins`
--

INSERT INTO `admins` (`id`, `name`, `phone`, `email`, `email_verified_at`, `password`, `remember_token`, `places`, `all_properties`, `orders`, `newsletter`, `contact_messages`, `site_setting`, `type`, `created_at`, `updated_at`) VALUES
(6, 'Admin', '01711212121', 'admin@gmail.com', NULL, '$2y$10$Wo43r5R2lxeZuFlxJH8hu.wbUPbvhkho0DtNxg6bnTtC7.IlJwF0e', NULL, '1', '1', '1', '1', '1', '1', '1', '2021-03-13 10:49:52', '2021-03-13 10:49:52');

-- --------------------------------------------------------

--
-- Table structure for table `cities`
--

CREATE TABLE `cities` (
  `id` bigint(20) UNSIGNED NOT NULL,
  `city_name` varchar(191) COLLATE utf8mb4_unicode_ci NOT NULL,
  `created_at` timestamp NULL DEFAULT current_timestamp(),
  `updated_at` timestamp NULL DEFAULT current_timestamp()
) ENGINE=InnoDB DEFAULT CHARSET=utf8mb4 COLLATE=utf8mb4_unicode_ci;

--
-- Dumping data for table `cities`
--

INSERT INTO `cities` (`id`, `city_name`, `created_at`, `updated_at`) VALUES
(1, 'Chattogram', NULL, NULL),
(2, 'Dhaka', NULL, NULL),
(3, 'Rajshahi', '2021-03-11 14:05:08', '2021-03-14 14:05:08'),
(4, 'Khulna', '2021-03-11 14:01:08', '2021-03-14 14:06:08'),
(5, 'Barisal', '2021-03-11 14:01:22', '2021-03-14 14:07:08'),
(6, 'Sylhet', '2021-03-11 14:01:31', '2021-03-14 14:04:08'),
(7, 'Comilla', '2021-03-11 14:01:49', '2021-03-14 14:05:07'),
(8, 'Rangpur', '2021-03-11 14:01:04', '2021-03-14 14:05:04'),
(10, 'Mymensingh', '2021-03-10 19:01:32', '2021-03-14 14:05:02');

-- --------------------------------------------------------

--
-- Table structure for table `contacts`
--

CREATE TABLE `contacts` (
  `id` bigint(20) UNSIGNED NOT NULL,
  `name` varchar(191) COLLATE utf8mb4_unicode_ci NOT NULL,
  `email` varchar(191) COLLATE utf8mb4_unicode_ci NOT NULL,
  `phone` varchar(191) COLLATE utf8mb4_unicode_ci NOT NULL,
  `subject` varchar(191) COLLATE utf8mb4_unicode_ci DEFAULT NULL,
  `message` longtext COLLATE utf8mb4_unicode_ci NOT NULL,
  `status` varchar(11) COLLATE utf8mb4_unicode_ci DEFAULT NULL,
  `review` int(11) DEFAULT NULL,
  `date` varchar(191) COLLATE utf8mb4_unicode_ci DEFAULT NULL,
  `created_at` timestamp NULL DEFAULT current_timestamp(),
  `updated_at` timestamp NULL DEFAULT current_timestamp()
) ENGINE=InnoDB DEFAULT CHARSET=utf8mb4 COLLATE=utf8mb4_unicode_ci;

--
-- Dumping data for table `contacts`
--

INSERT INTO `contacts` (`id`, `name`, `email`, `phone`, `subject`, `message`, `status`, `review`, `date`, `created_at`, `updated_at`) VALUES
(2, 'Irfan Chowdhury', 'irfan@gmail.com', '01877777777', NULL, 'Hey!\r\nI have found a renter for my propertiy, Please delete my property from your website which i sent you the previous month.', '1', 0, '03-03-21', '2021-03-03 10:56:34', '2021-03-04 10:56:34'),
(3, 'Arman', 'arman@gmail.com', '0181111112', 'Peoperties', 'Hey! Good Morning. How can edit my property add request form which is already sent to you? I had put there my old email address. I want to replace it with my new email account, Please response me to solve this issue. Thank You.', '1', 0, '02-02-21', '2021-02-02 15:31:38', '2021-02-03 15:31:38'),
(4, 'Helal Uddin', 'helal@gmail.com', '01811112212', 'Payment', 'Hi! Take my Salam.\r\n\r\nIs there any online payment system available to you?', '1', 0, '01-03-21', '2021-03-01 15:34:06', '2021-03-02 15:34:06'),
(5, 'Shahed Sultan', 'sultan@gmail.com', '22333455325', NULL, 'Assalamu Alaikum.\r\n\r\nYou guys are awesome, All thanks to \'BariWala\' for taking this kind of unique step and made our life easy,', '0', 0, '05-03-21', '2021-03-05 15:53:11', '2021-03-06 15:53:11'),
(6, 'Junayed Abdullah', 'junayed@gmail.com', '22333455325', 'Review', 'Nice to meet you guys!\r\nSo nice behaviour, Wish you good luck!', '0', 0, '08-03-21', '2021-03-07 18:20:07', '2021-03-10 18:20:07'),
(7, 'Nazim Uddin', 'Nazimhabib77@gmail.com', '01833000325', NULL, 'Is there anyone available?', '0', 0, '05-03-21', '2021-03-04 19:51:50', '2021-03-11 19:51:50'),
(8, 'jahed H Hossen', 'jahad@gmail.com', '+8801733455325', NULL, 'Bariwala.com does its job well, makes it easy to rent. Listing is easy, with just a few simple steps. Highly recommend on behalf of me.', '0', 1, '07-03-21', '2021-03-07 11:38:35', '2021-03-11 11:38:35'),
(9, 'Sazzad Hossen', 'sazzad@gmail.com', '+441733455325', NULL, 'I recommend using Bariwala.com if you want to quickly and easily list a property or apartment for rent or sell. It is simple to use and will get your listing in front of a larger audience.', '0', 1, '03-03-21', '2021-03-03 14:04:25', '2021-03-04 14:04:25'),
(10, 'Ariful Islam', 'aa@gmail.com', '+441733455325', NULL, 'I have found a much higher quality of renter by using this process. All thanks to Bariwala.com', '0', 1, '11-03-21', '2021-03-11 14:04:43', '2021-03-12 14:04:43'),
(11, 'Kamrul Hasan', 'kh@gmail.com', '+8801833455325', NULL, 'I think the Bariwala.com website could use some upgrades. It can be a little slow and glitchy sometimes.', '1', 0, '18-02-21', '2021-02-18 14:05:16', '2021-02-19 14:05:16'),
(12, 'Md Ariful Islam', 'arif@gmail.com', '01877766677', NULL, 'Straight forward accurate information, never any discrepancies between what I list through Appfolio and what Rent.com states.', '0', 1, '11-02-21', '2021-02-11 14:06:06', '2021-02-13 14:06:06'),
(13, 'Md Arman', 'arman@gmail.com', '01733455325', NULL, 'This site has a great design and features trending cities and pet-friendly apartments.', '0', 1, '15-03-21', '2021-03-15 14:07:07', '2021-03-16 14:07:07');

-- --------------------------------------------------------

--
-- Table structure for table `failed_jobs`
--

CREATE TABLE `failed_jobs` (
  `id` bigint(20) UNSIGNED NOT NULL,
  `connection` text COLLATE utf8mb4_unicode_ci NOT NULL,
  `queue` text COLLATE utf8mb4_unicode_ci NOT NULL,
  `payload` longtext COLLATE utf8mb4_unicode_ci NOT NULL,
  `exception` longtext COLLATE utf8mb4_unicode_ci NOT NULL,
  `failed_at` timestamp NOT NULL DEFAULT current_timestamp()
) ENGINE=InnoDB DEFAULT CHARSET=utf8mb4 COLLATE=utf8mb4_unicode_ci;

-- --------------------------------------------------------

--
-- Table structure for table `interested_properties`
--

CREATE TABLE `interested_properties` (
  `id` bigint(20) UNSIGNED NOT NULL,
  `name` varchar(191) COLLATE utf8mb4_unicode_ci NOT NULL,
  `email` varchar(191) COLLATE utf8mb4_unicode_ci NOT NULL,
  `phone` varchar(191) COLLATE utf8mb4_unicode_ci NOT NULL,
  `property_code` varchar(191) COLLATE utf8mb4_unicode_ci NOT NULL,
  `status` int(11) NOT NULL,
  `date` varchar(121) COLLATE utf8mb4_unicode_ci DEFAULT NULL,
  `message` varchar(191) COLLATE utf8mb4_unicode_ci DEFAULT NULL,
  `created_at` timestamp NULL DEFAULT current_timestamp(),
  `updated_at` timestamp NULL DEFAULT current_timestamp()
) ENGINE=InnoDB DEFAULT CHARSET=utf8mb4 COLLATE=utf8mb4_unicode_ci;

--
-- Dumping data for table `interested_properties`
--

INSERT INTO `interested_properties` (`id`, `name`, `email`, `phone`, `property_code`, `status`, `date`, `message`, `created_at`, `updated_at`) VALUES
(10, 'Faiaz Rahman', 'faiaz@gmail.com', '01755563634', 'BW-968529', 0, '01-05-20', 'I would like to inquire about your property BW-968529. Please contact me at your earliest convenience.', '2020-05-29 15:15:09', '2020-05-29 15:15:09'),
(12, 'Sazzad Hossen', 'sazzad@gmail.com', '01733455325', 'BW-422013', 1, '05-07-20', 'I would like to inquire about your property BW-422013. Please contact me at your earliest convenience.', '2020-05-29 15:25:23', '2020-05-29 15:25:23'),
(15, 'Sazzad Alam', 'alam@gmail.com', '01733455325', 'BW-889258', 1, '01-05-20', NULL, '2020-05-30 11:16:47', '2020-05-30 11:16:47'),
(19, 'Sakil Islam', 'sakil@gmail.com', '01874532626', 'BW-237224', 1, '05-07-20', NULL, '2020-05-30 14:40:04', '2020-05-30 14:40:04'),
(34, 'Hasan Chy', 'hasan@gmail.com', '01877746737', 'BW-544813', 1, '05-07-20', 'I would like to inquire about your property BW-544813. Please contact me at your earliest convenience.', '2020-06-02 07:05:53', '2020-06-02 07:05:53'),
(35, 'Alam Chy', 'alam@gmail.com', '01877756977', 'BW-236862', 1, '03-05-20', 'I would like to inquire about your property BW-236862. Please contact me at your earliest convenience.', '2020-06-02 07:07:43', '2020-06-02 07:07:43'),
(41, 'Sattar Alam', 'sattar@gmail.com', '01877746700', 'BW-768491', 1, '04-07-20', NULL, '2020-07-02 06:57:37', '2020-07-02 06:57:37'),
(44, 'Sazzad Hossen Alam', 'sazzad@gmail.com', '01733455325', 'BW-278360', 1, '02-07-20', 'I would like to inquire about your property BW-278360. Please contact me at your earliest convenience.', '2020-07-02 09:32:20', '2020-07-02 09:32:20'),
(47, 'Saiful Rao', 'saiful@gmail.com', '018347383748', 'BW-755138', 1, '03-07-20', 'I would like to inquire about your property BW-755138. Please contact me at your earliest convenience.', '2020-07-03 09:47:15', '2020-07-03 09:47:15'),
(48, 'Sajjad Hossen', 'sazzad@gmail.com', '01733455325', 'BW-122019', 1, '04-07-20', 'I would like to inquire about your property BW-122019. Please contact me at your earliest convenience.', '2020-07-04 10:37:49', '2020-07-04 10:37:49'),
(49, 'Shohel Alam Chy', 'shohel@gmail.com', '01734455325', 'BW-463561', 1, '04-07-20', 'I would like to inquire about your property BW-463561. Please contact me at your earliest convenience.', '2020-07-04 10:38:14', '2020-07-04 10:38:14'),
(52, 'Sattar Sumon', 'ss@gmail.com', '01877746735', 'BW-398293', 0, '05-07-20', 'I would like to inquire about your property BW-398293. Please contact me at your earliest convenience.', '2020-07-04 21:07:02', '2020-07-04 21:07:02'),
(53, 'Hosain Sakil Ahmed', 'Hsakil@gmail.com', '01844532626', 'BW-182691', 1, '13-07-20', 'I would like to inquire about your property BW-182691. Please contact me at your earliest convenience.', '2020-07-12 19:52:37', '2020-07-12 19:52:37'),
(54, 'Md. jahed  Hossen', 'jahad@gmail.com', '01733455325', 'BW-596873', 1, '13-07-20', 'I would like to inquire about your property BW-596873. Please contact me at your earliest convenience.', '2020-07-12 19:55:20', '2020-07-12 19:55:20'),
(55, 'Shikdar Hossen', 'Shikdar@gmail.com', '01733455325', 'BW-306648', 1, '13-07-20', 'I would like to inquire about your property BW-306648. Please contact me at your earliest convenience.', '2020-07-12 20:02:07', '2020-07-12 20:02:07'),
(57, 'Irfan Karim', 'irfan@gmail.com', '01733499925', 'BW-846585', 0, '21-09-20', 'I would like to inquire about your property BW-846585. Please contact me at your earliest convenience.', '2020-09-20 19:49:13', '2020-09-20 19:49:13'),
(65, 'jahed H Hossen', 'jahad@gmail.com', '+8801733455325', 'BW-192366', 1, '15-11-20', 'I would like to inquire about your property BW-192366. Please contact me at your earliest convenience.', '2020-11-15 05:15:50', '2020-11-15 05:15:50');

-- --------------------------------------------------------

--
-- Table structure for table `migrations`
--

CREATE TABLE `migrations` (
  `id` int(10) UNSIGNED NOT NULL,
  `migration` varchar(191) COLLATE utf8mb4_unicode_ci NOT NULL,
  `batch` int(11) NOT NULL
) ENGINE=InnoDB DEFAULT CHARSET=utf8mb4 COLLATE=utf8mb4_unicode_ci;

--
-- Dumping data for table `migrations`
--

INSERT INTO `migrations` (`id`, `migration`, `batch`) VALUES
(1, '2014_10_12_000000_create_users_table', 1),
(2, '2014_10_12_100000_create_password_resets_table', 1),
(3, '2019_08_19_000000_create_failed_jobs_table', 1),
(4, '2019_11_06_075920_create_admins_table', 1),
(5, '2020_04_17_213215_create_users_table', 2),
(6, '2020_04_29_132831_create_cities_table', 3),
(7, '2020_04_29_143441_create_subcities_table', 4),
(8, '2020_04_30_205511_create_user_properties_table', 5),
(9, '2020_05_02_135401_create_coupons_table', 6),
(10, '2020_05_02_155931_create_newsletters_table', 7),
(11, '2020_05_02_191336_create_post_category_table', 8),
(12, '2020_05_02_210021_create_posts_table', 9),
(13, '2020_05_06_080358_create_sitesetting_table', 10),
(14, '2020_05_08_100357_create_contacts_table', 11),
(15, '2020_05_13_205639_create_wishlists_table', 12),
(16, '2020_05_28_150243_create_interested_properties_table', 13),
(17, '2020_11_17_151750_create_orders_table', 14);

-- --------------------------------------------------------

--
-- Table structure for table `newsletters`
--

CREATE TABLE `newsletters` (
  `id` bigint(20) UNSIGNED NOT NULL,
  `email` varchar(191) COLLATE utf8mb4_unicode_ci NOT NULL,
  `created_at` timestamp NULL DEFAULT current_timestamp(),
  `updated_at` timestamp NULL DEFAULT current_timestamp()
) ENGINE=InnoDB DEFAULT CHARSET=utf8mb4 COLLATE=utf8mb4_unicode_ci;

--
-- Dumping data for table `newsletters`
--

INSERT INTO `newsletters` (`id`, `email`, `created_at`, `updated_at`) VALUES
(5, 'sazzad@gmail.com', '2021-03-13 10:27:50', '2021-03-13 10:27:50'),
(6, 'sakil@gmail.com', '2021-03-13 10:28:00', '2021-03-13 10:28:00');

-- --------------------------------------------------------

--
-- Table structure for table `orders`
--

CREATE TABLE `orders` (
  `id` bigint(20) UNSIGNED NOT NULL,
  `user_id` bigint(20) UNSIGNED DEFAULT NULL,
  `property_Id` bigint(20) UNSIGNED DEFAULT NULL,
  `amount` double DEFAULT NULL,
  `status` varchar(191) COLLATE utf8mb4_unicode_ci DEFAULT NULL,
  `transaction_id` varchar(191) COLLATE utf8mb4_unicode_ci DEFAULT NULL,
  `currency` varchar(191) COLLATE utf8mb4_unicode_ci DEFAULT NULL,
  `created_at` timestamp NULL DEFAULT current_timestamp(),
  `updated_at` timestamp NULL DEFAULT current_timestamp()
) ENGINE=InnoDB DEFAULT CHARSET=utf8mb4 COLLATE=utf8mb4_unicode_ci;

--
-- Dumping data for table `orders`
--

INSERT INTO `orders` (`id`, `user_id`, `property_Id`, `amount`, `status`, `transaction_id`, `currency`, `created_at`, `updated_at`) VALUES
(9, 2, 105, 500, 'Processing', '5fb3e3528bb32', 'BDT', '2020-11-17 14:50:58', '2020-11-17 14:50:58'),
(10, 2, 106, 500, 'Processing', '5fb3e8654e862', 'BDT', '2020-11-17 15:12:37', '2020-11-17 15:12:37'),
(11, 2, 107, 500, 'Failed', '5fb3e9e9b5da5', 'BDT', '2020-11-17 15:19:05', '2020-11-17 15:19:05'),
(12, 2, 108, 500, 'Done', '5fb3f0874a778', 'BDT', '2020-11-17 15:47:53', '2020-11-17 15:47:53'),
(14, 2, 111, 500, 'Done', '5fb4c9a65453e', 'BDT', '2020-11-18 07:14:08', '2020-11-18 07:14:08'),
(15, 2, 112, 500, 'Done', '5fb5ef08cd5ea', 'BDT', '2020-11-19 04:06:11', '2020-11-19 04:06:11');

-- --------------------------------------------------------

--
-- Table structure for table `password_resets`
--

CREATE TABLE `password_resets` (
  `email` varchar(191) COLLATE utf8mb4_unicode_ci NOT NULL,
  `token` varchar(191) COLLATE utf8mb4_unicode_ci NOT NULL,
  `created_at` timestamp NULL DEFAULT NULL
) ENGINE=InnoDB DEFAULT CHARSET=utf8mb4 COLLATE=utf8mb4_unicode_ci;

--
-- Dumping data for table `password_resets`
--

INSERT INTO `password_resets` (`email`, `token`, `created_at`) VALUES
('newuser@gmail.com', '$2y$10$pMl03hVTWEO8PNKmk1IiX.kyFtmr4fH2kFRRU3lXfQ8WfubqmbP1y', '2020-04-25 05:18:10');

-- --------------------------------------------------------

--
-- Table structure for table `sitesetting`
--

CREATE TABLE `sitesetting` (
  `id` bigint(20) UNSIGNED NOT NULL,
  `phone_one` varchar(191) COLLATE utf8mb4_unicode_ci DEFAULT NULL,
  `phone_two` varchar(191) COLLATE utf8mb4_unicode_ci DEFAULT NULL,
  `email_one` varchar(191) COLLATE utf8mb4_unicode_ci DEFAULT NULL,
  `email_two` varchar(191) COLLATE utf8mb4_unicode_ci DEFAULT NULL,
  `company_name` varchar(191) COLLATE utf8mb4_unicode_ci DEFAULT NULL,
  `address_one` varchar(191) COLLATE utf8mb4_unicode_ci DEFAULT NULL,
  `address_two` varchar(191) COLLATE utf8mb4_unicode_ci DEFAULT NULL,
  `logo` varchar(240) COLLATE utf8mb4_unicode_ci DEFAULT NULL,
  `facebook` varchar(191) COLLATE utf8mb4_unicode_ci DEFAULT NULL,
  `linkedin` varchar(191) COLLATE utf8mb4_unicode_ci DEFAULT NULL,
  `twitter` varchar(191) COLLATE utf8mb4_unicode_ci DEFAULT NULL,
  `youtube` varchar(191) COLLATE utf8mb4_unicode_ci DEFAULT NULL,
  `instagram` varchar(191) COLLATE utf8mb4_unicode_ci DEFAULT NULL,
  `pinterest` varchar(191) COLLATE utf8mb4_unicode_ci DEFAULT NULL,
  `whatsapp` varchar(191) COLLATE utf8mb4_unicode_ci DEFAULT NULL,
  `experience` varchar(191) COLLATE utf8mb4_unicode_ci DEFAULT NULL,
  `project` varchar(191) COLLATE utf8mb4_unicode_ci DEFAULT NULL,
  `award` varchar(191) COLLATE utf8mb4_unicode_ci DEFAULT NULL,
  `clients` varchar(191) COLLATE utf8mb4_unicode_ci DEFAULT NULL,
  `created_at` timestamp NULL DEFAULT current_timestamp(),
  `updated_at` timestamp NULL DEFAULT current_timestamp()
) ENGINE=InnoDB DEFAULT CHARSET=utf8mb4 COLLATE=utf8mb4_unicode_ci;

--
-- Dumping data for table `sitesetting`
--

INSERT INTO `sitesetting` (`id`, `phone_one`, `phone_two`, `email_one`, `email_two`, `company_name`, `address_one`, `address_two`, `logo`, `facebook`, `linkedin`, `twitter`, `youtube`, `instagram`, `pinterest`, `whatsapp`, `experience`, `project`, `award`, `clients`, `created_at`, `updated_at`) VALUES
(1, '01837373733', '01837373833', 'rental@gmail.com', 'rental@gmail.com', 'HouseRental', '5th Floor,  Finlay Square, 2 no gate', '3rd Floor, Jamuna Future Park', NULL, 'www.facebook.com/houserental', 'www.linkedin.com/houserental', 'www.twitter.com/houserental', 'www.youtube.com/houserental', 'www.instagram.com/houserental', 'www.pinterest.com/houserental', 'www.whatsapp.com/houserental', '26', '300', '37', '276', '2020-05-06 08:42:38', '2020-05-06 08:42:38');

-- --------------------------------------------------------

--
-- Table structure for table `subcities`
--

CREATE TABLE `subcities` (
  `id` bigint(20) UNSIGNED NOT NULL,
  `city_id` int(11) NOT NULL,
  `subcity_name` varchar(191) COLLATE utf8mb4_unicode_ci NOT NULL,
  `created_at` timestamp NULL DEFAULT current_timestamp(),
  `updated_at` timestamp NULL DEFAULT current_timestamp()
) ENGINE=InnoDB DEFAULT CHARSET=utf8mb4 COLLATE=utf8mb4_unicode_ci;

--
-- Dumping data for table `subcities`
--

INSERT INTO `subcities` (`id`, `city_id`, `subcity_name`, `created_at`, `updated_at`) VALUES
(1, 1, 'Raozan', NULL, NULL),
(2, 1, 'Muradpur', NULL, NULL),
(4, 2, 'Dhanmondi', NULL, NULL),
(7, 1, 'Agrabad', NULL, NULL),
(8, 2, 'Shabag', NULL, NULL),
(10, 1, 'A K Khan', '2020-04-29 19:16:49', '2020-04-29 19:16:49'),
(12, 2, 'Mirpur', '2020-04-30 10:22:48', '2020-04-30 10:22:48'),
(13, 4, 'Bagherhat', '2020-04-30 19:03:43', '2020-04-30 19:03:43'),
(14, 3, 'Durgapur', '2020-04-30 19:56:55', '2020-04-30 19:56:55'),
(15, 3, 'Charghat', '2020-04-30 19:57:04', '2020-04-30 19:57:04'),
(16, 3, 'Bagmara', '2020-04-30 19:57:13', '2020-04-30 19:57:13'),
(17, 8, 'Rangpur Sadar', '2020-04-30 19:57:26', '2020-04-30 19:57:26'),
(18, 8, 'Kaunia', '2020-04-30 19:57:36', '2020-04-30 19:57:36'),
(19, 8, 'Gangachhara', '2020-04-30 19:57:45', '2020-04-30 19:57:45'),
(20, 5, 'Banaripara', '2020-04-30 19:58:01', '2020-04-30 19:58:01'),
(21, 5, 'Bakerganj', '2020-04-30 19:58:09', '2020-04-30 19:58:09'),
(22, 5, 'Babuganj', '2020-04-30 19:58:18', '2020-04-30 19:58:18'),
(23, 10, 'Muktagachha', '2020-04-30 20:01:07', '2020-04-30 20:01:07'),
(28, 2, 'Nawabganj', '2020-04-30 20:01:59', '2020-04-30 20:01:59'),
(29, 2, 'Tejgaon', '2020-04-30 20:02:07', '2020-04-30 20:02:07'),
(30, 4, 'Phultala', '2020-04-30 20:02:22', '2020-04-30 20:02:22'),
(31, 4, 'Rupsha', '2020-04-30 20:02:29', '2020-04-30 20:02:29'),
(32, 4, 'Terokhada', '2020-04-30 20:02:37', '2020-04-30 20:02:37'),
(33, 6, 'Osmani Nagar', '2020-04-30 20:02:54', '2020-04-30 20:02:54'),
(34, 6, 'Sylhet Sadar', '2020-04-30 20:03:07', '2020-04-30 20:03:07'),
(35, 6, 'Kanaighat', '2020-04-30 20:03:21', '2020-04-30 20:03:21'),
(36, 7, 'Nangalkot', '2020-04-30 20:07:08', '2020-04-30 20:07:08'),
(37, 7, 'Lalmai', '2020-04-30 20:07:17', '2020-04-30 20:07:17'),
(38, 7, 'Laksam', '2020-04-30 20:07:25', '2020-04-30 20:07:25'),
(39, 7, 'Chauddagram', '2020-04-30 20:07:36', '2020-04-30 20:07:36'),
(42, 2, 'Savar', '2020-05-10 10:52:12', '2020-05-10 10:52:12'),
(43, 1, 'GEC', '2020-05-10 10:55:49', '2020-05-10 10:55:49'),
(44, 2, 'Noya Polton', '2020-05-10 16:08:06', '2020-05-10 16:08:06'),
(45, 1, 'Noakhali', '2020-05-10 16:20:29', '2020-05-10 16:20:29'),
(46, 10, 'Bhaluka', '2020-07-05 20:00:15', '2020-07-05 20:00:15'),
(47, 10, 'Kistopur', '2020-07-07 09:47:00', '2020-07-07 09:47:00'),
(48, 11, 'sssssss', '2021-03-13 09:06:51', '2021-03-13 09:06:51');

-- --------------------------------------------------------

--
-- Table structure for table `users`
--

CREATE TABLE `users` (
  `id` bigint(20) UNSIGNED NOT NULL,
  `name` varchar(191) COLLATE utf8mb4_unicode_ci NOT NULL,
  `email` varchar(191) COLLATE utf8mb4_unicode_ci NOT NULL,
  `phone` varchar(191) COLLATE utf8mb4_unicode_ci DEFAULT NULL,
  `email_verified_at` timestamp NULL DEFAULT NULL,
  `password` varchar(191) COLLATE utf8mb4_unicode_ci DEFAULT NULL,
  `remember_token` varchar(100) COLLATE utf8mb4_unicode_ci DEFAULT NULL,
  `created_at` timestamp NULL DEFAULT NULL,
  `updated_at` timestamp NULL DEFAULT NULL
) ENGINE=InnoDB DEFAULT CHARSET=utf8mb4 COLLATE=utf8mb4_unicode_ci;

--
-- Dumping data for table `users`
--

INSERT INTO `users` (`id`, `name`, `email`, `phone`, `email_verified_at`, `password`, `remember_token`, `created_at`, `updated_at`) VALUES
(11, 'user', 'user@gmail.com', '01878377565', NULL, '$2y$10$Q0v2cnf6.6ta6yH3xa5AeOnaaLpHhken44M1.PJjyFMlavQczz5Au', NULL, NULL, NULL);

-- --------------------------------------------------------

--
-- Table structure for table `user_properties`
--

CREATE TABLE `user_properties` (
  `id` bigint(20) UNSIGNED NOT NULL,
  `user_id` int(11) DEFAULT NULL,
  `city_id` int(11) DEFAULT NULL,
  `subcity_id` int(11) DEFAULT NULL,
  `name` varchar(121) COLLATE utf8mb4_unicode_ci NOT NULL,
  `email` varchar(191) COLLATE utf8mb4_unicode_ci NOT NULL,
  `phone` varchar(191) COLLATE utf8mb4_unicode_ci NOT NULL,
  `address` varchar(191) COLLATE utf8mb4_unicode_ci NOT NULL,
  `subcity` varchar(191) COLLATE utf8mb4_unicode_ci DEFAULT NULL,
  `bedroom` int(11) NOT NULL,
  `bathroom` int(11) NOT NULL,
  `parking` int(11) DEFAULT NULL,
  `type` text COLLATE utf8mb4_unicode_ci NOT NULL,
  `kitchen` int(11) NOT NULL,
  `area` varchar(191) COLLATE utf8mb4_unicode_ci NOT NULL,
  `price` varchar(191) COLLATE utf8mb4_unicode_ci NOT NULL,
  `discount_price` varchar(191) COLLATE utf8mb4_unicode_ci DEFAULT NULL,
  `total_price` varchar(111) COLLATE utf8mb4_unicode_ci DEFAULT NULL,
  `category` varchar(19) COLLATE utf8mb4_unicode_ci NOT NULL,
  `floor` varchar(12) COLLATE utf8mb4_unicode_ci DEFAULT NULL,
  `details` varchar(9990) COLLATE utf8mb4_unicode_ci NOT NULL,
  `purpose` varchar(19) COLLATE utf8mb4_unicode_ci NOT NULL,
  `image_one` varchar(191) COLLATE utf8mb4_unicode_ci NOT NULL,
  `image_two` varchar(191) COLLATE utf8mb4_unicode_ci NOT NULL,
  `image_three` varchar(191) COLLATE utf8mb4_unicode_ci NOT NULL,
  `status` int(240) NOT NULL,
  `property_code` varchar(99) COLLATE utf8mb4_unicode_ci DEFAULT NULL,
  `map_link` mediumtext COLLATE utf8mb4_unicode_ci DEFAULT NULL,
  `date` varchar(999) COLLATE utf8mb4_unicode_ci DEFAULT NULL,
  `month` varchar(999) COLLATE utf8mb4_unicode_ci DEFAULT NULL,
  `year` varchar(999) COLLATE utf8mb4_unicode_ci DEFAULT NULL,
  `hot_new` int(9) DEFAULT NULL,
  `service_charge` varchar(11) COLLATE utf8mb4_unicode_ci DEFAULT NULL,
  `added_by` varchar(19) COLLATE utf8mb4_unicode_ci DEFAULT NULL,
  `created_at` timestamp NULL DEFAULT current_timestamp(),
  `updated_at` timestamp NULL DEFAULT current_timestamp()
) ENGINE=InnoDB DEFAULT CHARSET=utf8mb4 COLLATE=utf8mb4_unicode_ci;

--
-- Dumping data for table `user_properties`
--

INSERT INTO `user_properties` (`id`, `user_id`, `city_id`, `subcity_id`, `name`, `email`, `phone`, `address`, `subcity`, `bedroom`, `bathroom`, `parking`, `type`, `kitchen`, `area`, `price`, `discount_price`, `total_price`, `category`, `floor`, `details`, `purpose`, `image_one`, `image_two`, `image_three`, `status`, `property_code`, `map_link`, `date`, `month`, `year`, `hot_new`, `service_charge`, `added_by`, `created_at`, `updated_at`) VALUES
(1, NULL, 2, 44, 'Ariful Islam', 'arif@gmail.com', '01877766677', '39 No. South Polton Ward', 'Noya Polton', 4, 2, 0, 'Flat', 1, '1,316 sqft', '35,000', NULL, '35000', 'Family', '3rd', '<ol><li>This meticulously reimagined smart tech enabled home offers a bright open Chef\'s kitchen, Kraftmaid cabinets, Cambria quartz counters and stainless steel appliances.Spacious master bedroom w/ remote controlled recessed lighting, custom walk-in closet and modern bathroom w/ Hansgrohe fixtures. </li><li>Stylish design and high end finishes w/ refinished hardwood floors, LED recessed lights, skylights, new interior paint and Milgard double pane windows.</li><li> Living room features a modern electric fireplace and beautiful display shelving. Lower level has two bedrooms, one bath, family room, wet bar and low maintenance yard. </li><li>New systems include copper pipes, electrical, water heater, furnace, roof, drywall and WIFI enabled 1 car garage door. Close to all the shops, restaurants, excellent schools and parks that Sunset has to offer.</li></ol><div><span style=\"white-space:pre\">		</span></div><ul><li>We suggest you make up your mind and steal this deal offered at best deal.</li></ul>', 'Rent', 'public/media/user_property/1668676643142012.jpg', 'public/media/user_property/1668676651448244.jpg', 'public/media/user_property/1668676660536732.jpg', 1, 'BW-593643', 'https://www.google.com/maps/embed?pb=!1m18!1m12!1m3!1d3652.3194984620754!2d90.41210331493279!3d23.735983484596474!2m3!1f0!2f0!3f0!3m2!1i1024!2i768!4f13.1!3m3!1m2!1s0x3755b85f081b9b07%3A0x768a0f336e6c9806!2zTmF5YSBQYWx0YW4gSmFtZSBNYXNqaWQg4Kao4Kef4Ka-IOCmquCmsuCnjeCmn-CmqCDgppzgpr7gpq7gp4cg4Kau4Ka44Kac4Ka_4Kam!5e0!3m2!1sen!2sbd!4v1605685114222!5m2!1sen!2sbd', '01-06-20', 'June', '2020', NULL, NULL, 'admin', '2020-06-01 20:20:34', '2020-06-01 20:20:34'),
(2, NULL, 2, 28, 'Sadab hasan', 'sadab@gmail.com', '01874532626', 'Kalabagan 1st Lane, Kalabagan', 'Nawabganj', 3, 1, 1, 'Flat', 1, '1,216 sqft', '9,000,000', NULL, '9000000', 'Bachelor', '5th', '<ol><li>Considering a suitable lifestyle, this is one of the best places to reside in. It is wonderful and comfortable flat for a family to move in. The respective unit welcomes with a great floor plan.</li><li> The flat has got amazing bedrooms with modish tiled flooring. All the washrooms are finished with the quality and durable fixtures. </li><li>You will have an apt kitchen area to have your desired cookery essentials. A great number of groceries, school, colleges and bus stops are also located in the nearby area. </li><li>This west facing lovely apartment includes 3 large bedrooms and 2 Washrooms With Imported Fittings.</li><li> Here are just a few of its wonderful features: Balcony, 24/7 security service &amp; water, gas available, Tiles Flooring, and so much more!</li></ol><div><br></div><ul><li>- We suggest you make up your mind and steal this deal offered at best deal.</li></ul>', 'Sale', 'public/media/user_property/1668687521515573.jpg', 'public/media/user_property/1668687554043453.jpg', 'public/media/user_property/1668687561852768.jpg', 1, 'BW-760855', 'https://www.google.com/maps/embed?pb=!1m18!1m12!1m3!1d3652.6778267255536!2d90.37473146493257!3d23.723196434602745!2m3!1f0!2f0!3f0!3m2!1i1024!2i768!4f13.1!3m3!1m2!1s0x3755b8d3a0d164e7%3A0xd9fcbd41aac70671!2sNawabganj%20Bazar%2C%20Nilambar%20Shaha%20Rd%2C%20Dhaka%201205!5e0!3m2!1sen!2sbd!4v1605684813046!5m2!1sen!2sbd', '01-06-20', 'June', '2020', NULL, NULL, 'admin', '2020-05-10 15:57:49', '2020-06-01 20:36:10'),
(3, 2, 1, 2, 'Arman', 'arman@gmail.com', '0181111112', 'Shanti Nagar R/A, Atorar Dipo', 'Muradpur', 4, 3, 2, 'Flat', 2, '1,316 sqft', '55,000', '53,000', '53100', 'Family', '2nd', '<ol><li>Considering a suitable lifestyle, this is one of the best places to reside in. </li><li>It is wonderful and comfortable flat for a family to move in. </li><li>The respective unit welcomes with a great floor plan. The flat has got amazing bedrooms with modish tiled flooring.</li><li> All the washrooms are finished with the quality and durable fixtures.</li><li> You will have an apt kitchen area to have your desired cookery essentials. </li><li>A great number of groceries, school, colleges and bus stops are also located in the nearby area. </li><li>We are here to assist you if you are thinking of starting days in a standard flat and make it your home. </li><li>This flat for sale is completed with a great floor plan. </li><li>The balconies would refill the happy time with your family after a hectic day from the daily chores. </li><li>Water, gas &amp; electricity supply is also available for this flat.</li></ol><ul><li>- Just give us a call right away to win the deal offered.</li></ul>', 'Rent', 'public/media/user_property/1668688678296328.jpg', 'public/media/user_property/1668688688998785.jpg', 'public/media/user_property/1668688706281642.jpg', 1, 'BW-840463', 'https://www.google.com/maps/embed?pb=!1m18!1m12!1m3!1d3689.2586060221606!2d91.82755051490739!3d22.38160638528135!2m3!1f0!2f0!3f0!3m2!1i1024!2i768!4f13.1!3m3!1m2!1s0x30acd87849fc9f5d%3A0xd5a36fd3597c0ee0!2sJanata%20Bank%20Limited%2C%20Aturar%20Depo%20Hashem%20Bazar!5e0!3m2!1sen!2sbd!4v1605683175599!5m2!1sen!2sbd', '05-07-20', 'July', '2020', 1, '100', NULL, '2020-05-01 20:17:50', '2020-05-01 20:17:50'),
(4, 3, 2, 12, 'Irfan Chowdhury', 'irfan@gmail.com', '01934555325', 'Prosanti Residential Area', 'Mirpur', 4, 3, 2, 'Flat', 2, '1,314 sqft', '46,000', NULL, '46200', 'Family', '3rd', '<ol><li>                            Showing by Private Appt or LB. Contemporary Five Bedroom Three Bath Luxurious Renovated Sunset Home. </li><li>This meticulously reimagined smart tech enabled home offers a bright open Chef\'s kitchen, Kraftmaid cabinets, \r\n\r\nCambria quartz counters and stainless steel appliances. </li><li>A highly desirable enclosed tunnel entry home offers 3 bedrooms 2 baths on the top floor. Spacious master bedroom w/ remote controlled recessed lighting, custom walk-in closet and modern bathroom w/ Hansgrohe fixtures. </li><li>Stylish design and high end finishes w/ refinished hardwood floors,\r\n\r\n LED recessed lights, skylights, new interior paint and Milgard double pane windows.</li><li> Living room features a modern electric fireplace and beautiful display shelving. </li><li>Lower level has two bedrooms, one bath, family room, wet bar and low maintenance yard. New systems include copper pipes, electrical, water heater, furnace, roof,\r\n\r\nWIFI enabled 1 car garage door. Close to all the shops, restaurants, excellent schools and parks that Sunset has to offer.\r\n                        </li></ol>', 'Rent', 'public/media/user_property/1668675084053458.jpg', 'public/media/user_property/1668675101684732.jpg', 'public/media/user_property/1668675135181350.jpg', 3, 'BW-888178', 'https://www.google.com/maps/embed?pb=!1m18!1m12!1m3!1d14602.702518325506!2d90.34510367960334!3d23.794562453080236!2m3!1f0!2f0!3f0!3m2!1i1024!2i768!4f13.1!3m3!1m2!1s0x3755c0e96fce29dd%3A0x6ccd9e51aba9e64d!2sMirpur-1%2C%20Dhaka!5e0!3m2!1sen!2sbd!4v1605684727327!5m2!1sen!2sbd', '05-07-20', 'July', '2020', NULL, '200', NULL, '2020-05-01 20:40:02', '2020-05-01 20:40:02'),
(5, NULL, 2, 29, 'Hasnat karim', 'hasnat@gmail.com', '01733455325', '12 no Prosanti R/a', 'Tejgaon', 3, 1, 1, 'Flat', 1, '1,216 sqft', '22,000', '19,000', '19000', 'Bachelor', '7th', '<ol><li>This meticulously reimagined smart tech enabled home offers a bright open Chef\'s kitchen, Kraftmaid cabinets, Cambria quartz counters and stainless steel appliances.Spacious master bedroom w/ remote controlled recessed lighting, custom walk-in closet and modern bathroom w/ Hansgrohe fixtures. </li><li>Stylish design and high end finishes w/ refinished hardwood floors, LED recessed lights, skylights, new interior paint and Milgard double pane windows. </li><li>Living room features a modern electric fireplace and beautiful display shelving. Lower level has two bedrooms, one bath, family room, wet bar and low maintenance yard. </li><li>New systems include copper pipes, electrical, water heater, furnace, roof, drywall and WIFI enabled 1 car garage door. Close to all the shops, restaurants, excellent schools and parks that Sunset has to offer.</li></ol><ul><li>- We suggest you make up your mind and steal this deal offered at best deal.</li></ul>', 'Rent', 'public/media/user_property/1668675853682762.jpg', 'public/media/user_property/1668675866892244.jpg', 'public/media/user_property/1668675876690421.jpg', 3, 'BW-306648', 'https://www.google.com/maps/embed?pb=!1m18!1m12!1m3!1d3654.1367095076016!2d90.40986461493154!3d23.671068584628628!2m3!1f0!2f0!3f0!3m2!1i1024!2i768!4f13.1!3m3!1m2!1s0x3755b97f771456c9%3A0xe7476c9d441f10e7!2sTeghoria%20High%20School!5e0!3m2!1sen!2sbd!4v1605684883013!5m2!1sen!2sbd', '13-07-20', 'July', '2020', NULL, NULL, 'admin', '2020-06-01 20:15:03', '2020-06-01 20:15:03'),
(6, 3, 1, 10, 'Ishtiaque Ahmed', 'ish@gmail.com', '01826962626', 'Prosanti R/A, Nabab Habibullah Road', 'A K Khan', 3, 2, 1, 'Flat', 1, '1,316 sqft', '40,000,000', NULL, '40000000', 'Sublet', '2nd', '<ol><li>                            A highly desirable enclosed tunnel entry home offers 3 bedrooms 2 baths on the top floor. </li><li>Spacious master bedroom w/ remote controlled recessed lighting, custom walk-in closet and modern bathroom w/ Hansgrohe fixtures. </li><li>Stylish design and high end finishes w/ refinished hardwood floors, LED recessed lights, skylights, new interior paint and Milgard double pane windows. Living room features a modern electric fireplace and beautiful display shelving. Lower level has two bedrooms, one bath, family room, wet bar and low maintenance yard. </li><li>New systems include copper pipes, electrical, water heater, furnace, roof, drywall and WIFI enabled 1 car garage door. Close to all the shops, restaurants, excellent schools and parks that Sunset has to offer.</li><li>This vacant place is very spacious and constructive. It is just a few minutes away from shopping, dining and local transport.</li><li> We think a lot of crucial facts while we think about getting new office space in a new location. </li><li>This place is giving you all these benefits along with good privacy and all-time utility supplies.</li><li>So what are you waiting for come and check this vacant space by yourself? We are quite sure you will find how a valuable deal it can be for you.&nbsp;&nbsp;\r\n                        </li></ol>', 'Sale', 'public/media/user_property/1668676215048233.jpg', 'public/media/user_property/1668676224760384.jpg', 'public/media/user_property/1668676233210487.jpg', 1, 'BW-398293', 'https://www.google.com/maps/embed?pb=!1m18!1m12!1m3!1d3689.5951356996193!2d91.77559951490711!3d22.368911085287937!2m3!1f0!2f0!3f0!3m2!1i1024!2i768!4f13.1!3m3!1m2!1s0x30acd90a2c5c4ca5%3A0xf89baf1b9b15d610!2sColonel%20Hat%20Foot%20Overbridge%2C%20Chittagong!5e0!3m2!1sen!2sbd!4v1605684022960!5m2!1sen!2sbd', '09-05-20', 'May', '2020', 1, NULL, NULL, '2020-05-09 15:41:34', '2020-05-09 15:41:34'),
(7, 2, 2, 42, 'Sabbir Ahmed', 'sabbir@gmail.com', '01877777777', '39 No. South C&B Ward', 'Savar', 1, 1, 0, 'Flat', 1, '1,716 sqft', '15,000', '14,000', '14000', 'Bachelor', '7th', '<ol><li>WIFI enabled 1 car garage door. Close to all the shops, restaurants, excellent schools and parks that Sunset has to offer. </li><li>Intercom, Safety Grill, Govt. gas connection, Electric connection, Geyser\r\n--Elevator, Security guard, Generator, CCTV, WASA connection, Water tank,</li><li>&nbsp;We think a lot of crucial facts while we think about getting new office space in a new location.</li><li> This place is giving you all these benefits along with good privacy and all-time utility supplies.</li><li>All the washrooms are finished with the quality and durable fixtures. </li><li>You will have an apt kitchen area to have your desired cookery essentials. </li><li>A great number of groceries, school, colleges and bus stops are also located in the nearby area. </li></ol><p>&nbsp; &nbsp; &nbsp; &nbsp; - So what are you waiting for come and check this vacant space by yourself? We are quite sure you will find how a valuable deal it can be for you.&nbsp;</p>', 'Rent', 'public/media/user_property/1668677138911157.jpg', 'public/media/user_property/1668677148479916.jpg', 'public/media/user_property/1668677158315827.jpg', 1, 'BW-714400', 'https://www.google.com/maps/embed?pb=!1m18!1m12!1m3!1d3649.0997335824104!2d90.256795814935!3d23.850591984539946!2m3!1f0!2f0!3f0!3m2!1i1024!2i768!4f13.1!3m3!1m2!1s0x3755ebd3a31fc6e1%3A0xe55aca4d05ef4fa2!2sThai%20Shop%20SAVAR%20NEW%20MARKET%20SAVAR%20DHAKA!5e0!3m2!1sen!2sbd!4v1605684973910!5m2!1sen!2sbd', '09-03-20', 'March', '2020', 1, NULL, NULL, '2020-05-09 15:50:34', '2020-05-09 15:50:34'),
(8, 2, 1, 43, 'Nayan Chy', 'nayan@gmail.com', '01753595454', '3 No Ward, Mirbari,Kadalpur', 'GEC', 14, 11, 1, 'Home', 7, '1,319 sqft', '45,000,000', NULL, '45000000', 'Family', NULL, '<ol><li>                            Magnificent 16,000 square foot mansion with panoramic views of the Golden Gate Bridge, Palace of Fine Arts, Alcatraz, Angel Island.</li><li> Completely renovated with exquisite architectural detailing, 7 bedrooms, 8 fabulous full bathrooms and 3 half baths, and 8 marble fireplaces. </li><li>Elevator to all floors including huge roof deck. Close to distinguished schools and Union and Fillmore Street stores and restaurants.</li><li> Prestigious 2008 San Francisco Decorator Showcase. </li><li>This is a beautiful apartment with massive open space and open lights from all sides and very quiet and peaceful\r\n		-Furnished details\r\n			Indoor\r\n			Intercom, </li><li>Safety Grill, Govt. gas connection, Electric connection, Geyser\r\n\r\n			Outdoor\r\n			Elevator, Security guard, Generator, CCTV, WASA connection, Water tank, Guard\'s room</li><li>All the washrooms are finished with the quality and durable fixtures. </li><li>You will have an apt kitchen area to have your desired cookery essentials. </li><li>A great number of groceries, school, colleges and bus stops are also located in the nearby area.&nbsp;\r\n                        </li></ol>', 'Sale', 'public/media/user_property/1668676313006312.jpg', 'public/media/user_property/1668676321186811.jpg', 'public/media/user_property/1668676337705962.jpg', 2, 'BW-465488', 'https://www.google.com/maps/embed?pb=!1m18!1m12!1m3!1d3689.868349738098!2d91.81792071490693!3d22.358599285293348!2m3!1f0!2f0!3f0!3m2!1i1024!2i768!4f13.1!3m3!1m2!1s0x30acd890302b7dc7%3A0x8079b24b40e312d6!2sGEC%20Convention%20Center%20Helipad!5e0!3m2!1sen!2sbd!4v1605684368092!5m2!1sen!2sbd', '05-07-20', 'July', '2020', NULL, NULL, NULL, '2020-05-10 10:17:45', '2020-05-10 10:17:45'),
(9, NULL, 2, 12, 'Habib alam', 'Habib_d@gmail.com', '01733455325', '3 No Road,Section 10', 'Mirpur', 6, 4, 1, 'Flat', 1, '1,316 sqft', '9,900,000', NULL, '9900000', 'Family', '3rd', '<ol><li>Considering a suitable lifestyle, this is one of the best places to reside in. It is wonderful and comfortable flat for a family to move in. </li><li>The respective unit welcomes with a great floor plan. The flat has got amazing bedrooms with modish tiled flooring. All the washrooms are finished with the quality and durable fixtures. You will have an apt kitchen area to have your desired cookery essentials. </li><li>A great number of groceries, school, colleges and bus stops are also located in the nearby area. </li><li>This west facing lovely apartment includes 3 large bedrooms and 2 Washrooms With Imported Fittings. </li><li>Here are just a few of its wonderful features: Balcony, 24/7 security service &amp; water, gas available, Tiles Flooring, and so much more!</li></ol><div><br></div><ul><li>- We suggest you make up your mind and steal this deal offered at best deal.</li></ul>', 'Sale', 'public/media/user_property/1668688587049466.jpg', 'public/media/user_property/1668688598946440.jpg', 'public/media/user_property/1668688607936854.jpg', 1, 'BW-789766', 'https://www.google.com/maps/embed?pb=!1m18!1m12!1m3!1d14602.702518325506!2d90.34510367960334!3d23.794562453080236!2m3!1f0!2f0!3f0!3m2!1i1024!2i768!4f13.1!3m3!1m2!1s0x3755c0e96fce29dd%3A0x6ccd9e51aba9e64d!2sMirpur-1%2C%20Dhaka!5e0!3m2!1sen!2sbd!4v1605684727327!5m2!1sen!2sbd', '01-06-20', 'June', '2020', NULL, NULL, 'admin', '2020-06-01 20:42:37', '2020-06-01 20:42:37'),
(10, NULL, 2, 44, 'Shakaoat Hossen', 'shakaoat@gmail.com', '01811771112', '8 No Road,BM Residential Area', 'Noya Polton', 7, 5, 1, 'Home', 3, '1,516 sqft', '50,000,000', NULL, '50000000', 'Family', NULL, '<ol><li>Showing by Private Appt or LB. Contemporary Five Bedroom Three Bath Luxurious Renovated Sunset Home.</li><li> This meticulously reimagined smart tech enabled home offers a bright open Chef\'s kitchen, Kraftmaid cabinets, Cambria quartz counters and stainless steel appliances. </li><li>A highly desirable enclosed tunnel entry home offers 3 bedrooms 2 baths on the top floor. Spacious master bedroom w/ remote controlled recessed lighting, custom walk-in closet and modern bathroom w/ Hansgrohe fixtures. </li><li>Stylish design and high end finishes w/ refinished hardwood floors, LED recessed lights, skylights, new interior paint and Milgard double pane windows.</li><li> Living room features a modern electric fireplace and beautiful display shelving. </li><li>Lower level has two bedrooms, one bath, family room, wet bar and low maintenance yard. </li><li>New systems include copper pipes, electrical, water heater, furnace, roof, drywall and WIFI enabled 1 car garage door. Close to all the shops, restaurants, excellent schools and parks that Sunset has to offer.\r\n                        </li></ol>', 'Sale', 'public/media/user_property/1668677034490158.jpg', 'public/media/user_property/1668677024132704.jpg', 'public/media/user_property/1668677054749372.jpg', 1, 'BW-646347', 'https://www.google.com/maps/embed?pb=!1m18!1m12!1m3!1d3652.3194984620754!2d90.41210331493279!3d23.735983484596474!2m3!1f0!2f0!3f0!3m2!1i1024!2i768!4f13.1!3m3!1m2!1s0x3755b85f081b9b07%3A0x768a0f336e6c9806!2zTmF5YSBQYWx0YW4gSmFtZSBNYXNqaWQg4Kao4Kef4Ka-IOCmquCmsuCnjeCmn-CmqCDgppzgpr7gpq7gp4cg4Kau4Ka44Kac4Ka_4Kam!5e0!3m2!1sen!2sbd!4v1605685114222!5m2!1sen!2sbd', '10-05-20', 'May', '2020', NULL, NULL, 'admin', '2020-05-10 15:57:46', '2020-05-10 15:57:46'),
(11, 2, 1, 45, 'Ariful Islam', 'arif@gmail.com', '01877766677', 'BMC R/A,Brammonhat,Maijdee', 'Noakhali', 3, 2, 1, 'Flat', 1, '1,316 sqft', '15,000', NULL, '15000', 'Sublet', '2nd', '<ol><li>                            Stylish design and high end finishes w/ refinished hardwood floors, LED recessed lights, skylights, new interior paint and Milgard double pane windows.</li><li> Living room features a modern electric fireplace and beautiful display shelving. Lower level has two bedrooms, one bath, family room, wet bar and low maintenance yard.</li><li> New systems include copper pipes, electrical, water heater, furnace, roof, drywall and WIFI enabled 1 car garage door.</li><li>All the washrooms are finished with the quality and durable fixtures. </li><li>You will have an apt kitchen area to have your desired cookery essentials. </li><li>A great number of groceries, school, colleges and bus stops are also located in the nearby area.&nbsp; </li><li>Close to all the shops, restaurants, excellent schools and parks that Sunset has to offer.\r\n                        </li></ol>', 'Rent', 'public/media/user_property/1668674995999385.jpg', 'public/media/user_property/1668675006230730.jpg', 'public/media/user_property/1668675015256264.jpg', 3, 'BW-889258', 'https://www.google.com/maps/embed?pb=!1m18!1m12!1m3!1d3652.3194984620754!2d90.41210331493279!3d23.735983484596474!2m3!1f0!2f0!3f0!3m2!1i1024!2i768!4f13.1!3m3!1m2!1s0x3755b85f081b9b07%3A0x768a0f336e6c9806!2zTmF5YSBQYWx0YW4gSmFtZSBNYXNqaWQg4Kao4Kef4Ka-IOCmquCmsuCnjeCmn-CmqCDgppzgpr7gpq7gp4cg4Kau4Ka44Kac4Ka_4Kam!5e0!3m2!1sen!2sbd!4v1605685114222!5m2!1sen!2sbd', '05-06-20', 'June', '2020', NULL, NULL, NULL, '2020-05-10 16:15:19', '2020-05-10 16:15:19'),
(12, 3, 1, 7, 'Emon Chowdhury', 'emo@gmail.com', '01826232626', '3 No. Panchlaish Ward', 'Agrabad', 3, 2, 1, 'Flat', 1, '1700 sqft', '20000', '18,000', '18000', 'Bachelor', '7th', '<p>                            </p><ol><li>This vacant place is very spacious and constructive. It is just a few minutes away from shopping, dining and local transport. </li><li>We think a lot of crucial facts while we think about getting new office space in a new location. </li><li>This place is giving you all these benefits along with good privacy and all-time utility supplies.</li><li>All the washrooms are finished with the quality and durable fixtures. </li><li>You will have an apt kitchen area to have your desired cookery essentials. </li><li>A great number of groceries, school, colleges and bus stops are also located in the nearby area.&nbsp; </li><li>So what are you waiting for come and check this vacant space by yourself? We are quite sure you will find how a valuable deal it can be for you.\r\n                        </li></ol>', 'Rent', 'public/media/user_property/1668686425853248.jpg', 'public/media/user_property/1668686467100160.jpg', 'public/media/user_property/1668686483780345.jpg', 1, 'BW-991331', 'https://www.google.com/maps/embed?pb=!1m18!1m12!1m3!1d7381.58205313981!2d91.80911932473637!3d22.323741691245488!2m3!1f0!2f0!3f0!3m2!1i1024!2i768!4f13.1!3m3!1m2!1s0x30acd8b5353672d5%3A0x7e873374534df3f1!2sAgrabad%20Commercial%20Area%2C%20Chattogram!5e0!3m2!1sen!2sbd!4v1605683841574!5m2!1sen!2sbd', '11-05-20', 'May', '2020', NULL, NULL, NULL, '2020-05-11 18:32:41', '2020-05-11 18:32:41'),
(13, NULL, 2, 44, 'Sakil Ahmed', 'sakil@gmail.com', '01874532626', '102.A.D, 5no Sector', 'Noya Polton', 16, 9, 1, 'Home', 5, '1,566 sqft', '12,000,000', NULL, '12000000', 'Family', NULL, '<ol><li>Considering a suitable lifestyle, this is one of the best places to reside in. It is wonderful and comfortable flat for a family to move in. </li><li>The respective unit welcomes with a great floor plan. The flat has got amazing bedrooms with modish tiled flooring. </li><li>All the washrooms are finished with the quality and durable fixtures. You will have an apt kitchen area to have your desired cookery essentials. </li><li>A great number of groceries, school, colleges and bus stops are also located in the nearby area. </li><li>This west facing lovely apartment&nbsp; With Imported Fittings. Here are just a few of its wonderful features: Balcony, </li><li>24/7 security service &amp; water, gas available, Tiles Flooring, and so much more!</li></ol><div><br></div><ul><li>- We suggest you make up your mind and steal this deal offered at best deal.</li></ul>', 'Sale', 'public/media/user_property/1668676072191210.jpg', 'public/media/user_property/1668676081082096.jpg', 'public/media/user_property/1668676097984241.jpg', 1, 'BW-371583', 'https://www.google.com/maps/embed?pb=!1m18!1m12!1m3!1d3652.3194984620754!2d90.41210331493279!3d23.735983484596474!2m3!1f0!2f0!3f0!3m2!1i1024!2i768!4f13.1!3m3!1m2!1s0x3755b85f081b9b07%3A0x768a0f336e6c9806!2zTmF5YSBQYWx0YW4gSmFtZSBNYXNqaWQg4Kao4Kef4Ka-IOCmquCmsuCnjeCmn-CmqCDgppzgpr7gpq7gp4cg4Kau4Ka44Kac4Ka_4Kam!5e0!3m2!1sen!2sbd!4v1605685114222!5m2!1sen!2sbd', '01-06-20', 'June', '2020', NULL, NULL, 'admin', '2020-06-01 20:47:32', '2020-06-01 20:47:32'),
(14, 2, 2, 4, 'Faiaz Rahman', 'faiaz@gmail.com', '01755563634', 'Chand Mia Road, 4 No Chandgaon Ward', 'Dhanmondi', 10, 8, 2, 'Home', 8, '3,010 sqft', '130,000,000', NULL, '130000000', 'Family', NULL, '<ol><li>                            Considering a suitable lifestyle, this is one of the best places to reside in. </li><li>It is wonderful and comfortable flat for a family to move in. The respective unit welcomes with a great floor plan. </li><li>The flat has got amazing bedrooms with modish tiled flooring. </li><li>All the washrooms are finished with the quality and durable fixtures. You will have an apt kitchen area to have your desired cookery essentials. </li><li>A great number of groceries, school, colleges and bus stops are also located in the nearby area.</li><li>All the washrooms are finished with the quality and durable fixtures. </li><li>You will have an apt kitchen area to have your desired cookery essentials. A great number of groceries, school, colleges and bus stops are also located in the nearby area.&nbsp;\r\n                        </li></ol>', 'Sale', 'public/media/user_property/1668686230358919.jpg', 'public/media/user_property/1668686243140201.jpg', 'public/media/user_property/1668686263071217.jpg', 1, 'BW-968529', 'https://www.google.com/maps/embed?pb=!1m18!1m12!1m3!1d3651.899205867239!2d90.37139331493307!3d23.750973484589124!2m3!1f0!2f0!3f0!3m2!1i1024!2i768!4f13.1!3m3!1m2!1s0x3755bf4d6018f643%3A0x603d2d083289b4a3!2sDhanmondi%2032%20Road%20Bridge%2C%20Dhanmondi%20Bridge%2C%20Dhaka%201209!5e0!3m2!1sen!2sbd!4v1605684555916!5m2!1sen!2sbd', '11-05-20', 'May', '2020', NULL, NULL, NULL, '2020-05-11 18:38:17', '2020-05-11 18:38:17'),
(15, 3, 2, 8, 'Azam Khan', 'azam@gmail.com', '01811412212', '3 No. Panchlaish Ward, Bayazid', 'Shabag', 12, 10, 2, 'Home', 8, '1,816 sqft', '120,000,000', NULL, '120000000', 'Bachelor', NULL, '<ol><li>                            We are here to assist you if you are thinking of starting days in a standard flat and make it your home. </li><li>This Home offering one of its best properties to decide your permanent address. This flat for sale is completed with a great floor plan. </li><li>The balconies would refill the happy time with your family after a hectic day from the daily chores. </li><li>Water, gas &amp; electricity supply is also available for this flat. </li><li>\r\n\r\nJust give us a call right away to win the deal offered.</li><li>All the washrooms are finished with the quality and durable fixtures.</li><li> You will have an apt kitchen area to have your desired cookery essentials. </li><li>A great number of groceries, school, colleges and bus stops are also located in the nearby area.&nbsp;\r\n                        </li></ol>', 'Sale', 'public/media/user_property/1668675067886538.jpg', 'public/media/user_property/1668675038154368.jpg', 'public/media/user_property/1668675048690675.jpg', 2, 'BW-596873', 'https://www.google.com/maps/embed?pb=!1m18!1m12!1m3!1d3652.2145805089535!2d90.39207231493289!3d23.73972628459464!2m3!1f0!2f0!3f0!3m2!1i1024!2i768!4f13.1!3m3!1m2!1s0x3755b978e41d0927%3A0xb3b75efd89a1700a!2sShabagh!5e0!3m2!1sen!2sbd!4v1605684617436!5m2!1sen!2sbd', '11-05-20', 'May', '2020', NULL, NULL, NULL, '2020-05-11 18:41:40', '2020-05-11 18:41:40'),
(16, 2, 2, 28, 'Sazzad Hossen', 'sazzad@gmail.com', '01733455325', 'Nabab Habibullah Road,Adamji', 'Nawabganj', 4, 3, 2, 'Flat', 1, '1,550 sqft', '50,000', NULL, '50000', 'Sublet', '2nd', '<ol><li>                            A beautiful, well ventilated and open flat is ready to move in the amicable locality of Mirpur. </li><li>To make sure you are gratified with the home that has always been pictured in your mind, we have enlisted the image of this flat below. Utilities are readily available in this apartment.</li><li>  There are balconies to make your apartment life more comfortable in the flat.</li><li>All the washrooms are finished with the quality and durable fixtures. </li><li>You will have an apt kitchen area to have your desired cookery essentials. </li><li>A great number of groceries, school, colleges and bus stops are also located in the nearby area.&nbsp;<br></li><li> \r\n\r\n Make yourself a happy buyer by calling us about this beautiful apartment right away!\r\n                        </li></ol>', 'Rent', 'public/media/user_property/1668675309682250.jpg', 'public/media/user_property/1668674961492518.jpg', 'public/media/user_property/1668674976602292.jpg', 2, 'BW-422013', 'https://www.google.com/maps/embed?pb=!1m18!1m12!1m3!1d3652.6778267255536!2d90.37473146493257!3d23.723196434602745!2m3!1f0!2f0!3f0!3m2!1i1024!2i768!4f13.1!3m3!1m2!1s0x3755b8d3a0d164e7%3A0xd9fcbd41aac70671!2sNawabganj%20Bazar%2C%20Nilambar%20Shaha%20Rd%2C%20Dhaka%201205!5e0!3m2!1sen!2sbd!4v1605684813046!5m2!1sen!2sbd', '05-07-20', 'July', '2020', NULL, NULL, NULL, '2020-05-11 18:44:47', '2020-05-11 18:44:47'),
(17, 2, 2, 29, 'Jahed khan', 'jahed@gmail.com', '01817114412', 'West Khulshi, 9 No. North Pahartali Ward,', 'Tejgaon', 4, 2, 2, 'Flat', 2, '1,555 sqft', '40,000', NULL, '40000', 'Family', '6th', '<ol><li>                            This vacant place is very spacious and constructive. It is just a few minutes away from shopping, dining and local transport. </li><li>We think a lot of crucial facts while we think about getting new office space in a new location. </li><li>This place is giving you all these benefits along with good privacy and all-time utility supplies. </li><li>So what are you waiting for come and check this vacant space by yourself? We are quite sure you will find how a valuable deal it can be for you.</li><li>All the washrooms are finished with the quality and durable fixtures. </li><li>You will have an apt kitchen area to have your desired cookery essentials. </li><li>A great number of groceries, school, colleges and bus stops are also located in the nearby area.&nbsp;\r\n                        </li></ol>', 'Rent', 'public/media/user_property/1668685862214769.jpg', 'public/media/user_property/1668685979884576.jpg', 'public/media/user_property/1668656762438982.jpg', 1, 'BW-914106', 'https://www.google.com/maps/embed?pb=!1m18!1m12!1m3!1d3654.1367095076016!2d90.40986461493154!3d23.671068584628628!2m3!1f0!2f0!3f0!3m2!1i1024!2i768!4f13.1!3m3!1m2!1s0x3755b97f771456c9%3A0xe7476c9d441f10e7!2sTeghoria%20High%20School!5e0!3m2!1sen!2sbd!4v1605684883013!5m2!1sen!2sbd', '11-05-20', 'May', '2020', NULL, NULL, NULL, '2020-05-11 18:47:06', '2020-05-11 18:47:06'),
(18, 3, 2, 42, 'Bellal Alam', 'belel@gmail.com', '0185636355', 'West Shewrapara, Adamji', 'Savar', 2, 1, 0, 'Flat', 1, '1200 sqft', '25,000', '24,000', '24000', 'Bachelor', '2nd', '<ol><li>                            A well constructed and nicely planned commercial space is up for sale. </li><li>The property is located in a place that will provide you with location benefits which are undoubtedly one of the most crucial elements for a successful business. </li><li>This is the exact location to run your business smoothly. </li><li>  \r\n\r\nFeel free to reach us for your further queries.</li><li>&nbsp;We think a lot of crucial facts while we think about getting new office space in a new location.</li><li> This place is giving you all these benefits along with good privacy and all-time utility supplies.</li><li>All the washrooms are finished with the quality and durable fixtures. </li><li>You will have an apt kitchen area to have your desired cookery essentials. </li><li>A great number of groceries, school, colleges and bus stops are also located in the nearby area.&nbsp; </li><li>So what are you waiting for come and check this vacant space by yourself? We are quite sure you will find how a valuable deal it can be for you.&nbsp;\r\n                        </li></ol>', 'Rent', 'public/media/user_property/1668676538357618.jpg', 'public/media/user_property/1668676550811136.jpg', 'public/media/user_property/1668676559627806.jpg', 1, 'BW-531384', 'https://www.google.com/maps/embed?pb=!1m18!1m12!1m3!1d3649.0997335824104!2d90.256795814935!3d23.850591984539946!2m3!1f0!2f0!3f0!3m2!1i1024!2i768!4f13.1!3m3!1m2!1s0x3755ebd3a31fc6e1%3A0xe55aca4d05ef4fa2!2sThai%20Shop%20SAVAR%20NEW%20MARKET%20SAVAR%20DHAKA!5e0!3m2!1sen!2sbd!4v1605684973910!5m2!1sen!2sbd', '11-05-20', 'May', '2020', NULL, NULL, NULL, '2020-05-11 18:50:18', '2020-05-11 18:50:18'),
(19, 2, 3, 14, 'Alam Khan', 'alam@gmail.com', '0182626244', 'Borobag, South Nazimpur', 'Durgapur', 13, 10, 2, 'Home', 9, '1,550 sqft', '110,000,000', NULL, '110000000', 'Family', NULL, '<p>                            </p><ol><li>Considering a suitable lifestyle, this is one of the best places to reside in.</li><li>It is wonderful and comfortable flat for a family to move in.</li><li>The respective unit welcomes with a great floor plan.</li><li>The flat has got amazing bedrooms with modish tiled flooring.</li><li>All the washrooms are finished with the quality and durable fixtures.</li><li>You will have an apt kitchen area to have your desired cookery essentials.</li><li>A great number of groceries, school, colleges and bus stops are also located in the nearby area.&nbsp;</li><li>This flat for sale is completed with a great floor plan.</li><li>The balconies would refill the happy time with your family after a hectic day from the daily chores.</li><li>Water, gas &amp; electricity supply is also available for this flat.&nbsp;</li><li>We suggest you make up your mind and steal this deal offered at best deal.</li></ol>', 'Sale', 'public/media/user_property/1668676466849031.jpg', 'public/media/user_property/1668676475673459.jpg', 'public/media/user_property/1668676498287320.jpg', 1, 'BW-481752', 'https://www.google.com/maps/embed?pb=!1m18!1m12!1m3!1d14528.468746588776!2d88.75854482980836!3d24.44671924801001!2m3!1f0!2f0!3f0!3m2!1i1024!2i768!4f13.1!3m3!1m2!1s0x39fbf5c06b065de9%3A0xdd8592e0d156d6f0!2sDurgapur!5e0!3m2!1sen!2sbd!4v1605685807793!5m2!1sen!2sbd', '11-05-20', 'May', '2020', NULL, NULL, NULL, '2020-05-11 18:54:37', '2020-05-11 18:54:37'),
(20, 2, 3, 15, 'Ayan Chowdhury', 'ar@gmail.com', '0182626463', 'Nabab Habibullah Road,CDA R/A', 'Charghat', 2, 1, 1, 'Flat', 1, '1,455 sqft', '12,000', NULL, '12000', 'Bachelor', '2nd', '<ol><li>                            A beautiful, well ventilated and open flat is ready to move in the amicable locality of Mirpur.</li><li> To make sure you are gratified with the home that has always been pictured in your mind, </li><li>we have enlisted the image of this flat below. Utilities are readily available in this apartment.  There are balconies to make your apartment life more comfortable in the flat. </li><li>\r\n\r\n Make yourself a happy buyer by calling us about this beautiful apartment right away!</li><li>All the washrooms are finished with the quality and durable fixtures. </li><li>You will have an apt kitchen area to have your desired cookery essentials. </li><li>A great number of groceries, school, colleges and bus stops are also located in the nearby area.&nbsp;\r\n                        </li></ol>', 'Rent', 'public/media/user_property/1668677209737538.jpg', 'public/media/user_property/1668677218299534.jpg', 'public/media/user_property/1668677231872898.jpg', 1, 'BW-731906', 'https://www.google.com/maps/embed?pb=!1m18!1m12!1m3!1d3636.8250273267813!2d88.74622821494346!3d24.28284128432956!2m3!1f0!2f0!3f0!3m2!1i1024!2i768!4f13.1!3m3!1m2!1s0x39fbf9aabf16723d%3A0x58eabe8961ac57bd!2sCharghat%20Bazaar%20Durga%20Mondir!5e0!3m2!1sen!2sbd!4v1605685870062!5m2!1sen!2sbd', '11-05-20', 'May', '2020', NULL, NULL, NULL, '2020-05-11 18:57:17', '2020-05-11 18:57:17'),
(21, 2, 3, 16, 'jahangir alam', 'alam@gmail.com', '01811116345', 'Section 10, Nobab ali Road', 'Bagmara', 4, 3, 3, 'Flat', 2, '1,252 sqft', '40,000', NULL, '40000', 'Family', '3rd', '<ol><li><span style=\"font-size: 0.875rem;\">Showing by Private Appt or LB. Contemporary Five Bedroom Three Bath Luxurious Renovated Sunset Home. </span></li><li><span style=\"font-size: 0.875rem;\">This meticulously reimagined smart tech enabled home offers a bright open Chef\'s kitchen, Kraftmaid cabinets, Cambria quartz counters and stainless steel appliances. </span></li><li><span style=\"font-size: 0.875rem;\">A highly desirable enclosed tunnel entry home offers 3 bedrooms 2 baths on the top floor. </span></li><li><span style=\"font-size: 0.875rem;\">Spacious master bedroom w/ remote controlled recessed lighting, custom walk-in closet and modern bathroom w/ Hansgrohe fixtures. </span></li><li><span style=\"font-size: 0.875rem;\">Stylish design and high end finishes w/ refinished hardwood floors, LED recessed lights, skylights, new interior paint and Milgard double pane windows.</span></li><li><span style=\"font-size: 0.875rem;\"> Living room features a modern electric fireplace and beautiful display shelving. Lower level has two bedrooms, one bath, family room, wet bar and low maintenance yard. </span></li><li><span style=\"font-size: 0.875rem;\">New systems include copper pipes, electrical, water heater, furnace, roof, drywall and WIFI enabled 1 car garage door. Close to all the shops, restaurants, excellent schools and parks that Sunset has to offer.</span><br></li></ol>', 'Rent', 'public/media/user_property/1668686302446950.jpg', 'public/media/user_property/1668686323541508.jpg', 'public/media/user_property/1668656903827973.jpg', 1, 'BW-989233', 'https://www.google.com/maps/embed?pb=!1m18!1m12!1m3!1d3628.897148897265!2d88.80558111494892!3d24.558216084197433!2m3!1f0!2f0!3f0!3m2!1i1024!2i768!4f13.1!3m3!1m2!1s0x39fc750d279d5ed9%3A0x34802715878a4f56!2sBagmara%20Police%20Station!5e0!3m2!1sen!2sbd!4v1605685941077!5m2!1sen!2sbd', '11-05-20', 'May', '2020', NULL, NULL, NULL, '2020-05-11 18:59:16', '2020-05-11 18:59:16'),
(22, 3, 4, 13, 'Shah Alam', 'shah@gmail.com', '01826262545', 'Satmasjid Road, North khan para', 'Bagherhat', 8, 6, 2, 'Home', 5, '3,010 sqft', '120,000,000', NULL, '120000000', 'Family', NULL, '<ol><li>                            Showing by Private Appt or LB. Contemporary Five Bedroom Three Bath Luxurious Renovated Sunset Home. This meticulously reimagined smart tech enabled home offers a bright open Chef\'s kitchen, Kraftmaid cabinets, Cambria quartz counters and stainless steel appliances. </li><li>A highly desirable enclosed tunnel entry home offers 3 bedrooms 2 baths on the top floor. Spacious master bedroom w/ remote controlled recessed lighting, custom walk-in closet and modern bathroom w/ Hansgrohe fixtures. </li><li>Stylish design and high end finishes w/ refinished hardwood floors, LED recessed lights, skylights, new interior paint and Milgard double pane windows.</li><li> Living room features a modern electric fireplace and beautiful display shelving. Lower level has two bedrooms, one bath, family room, wet bar and low maintenance yard.</li><li> New systems include copper pipes, electrical, water heater, furnace, roof, drywall and WIFI enabled 1 car garage door. Close to all the shops, restaurants, excellent schools and parks that Sunset has to offer.\r\n                        </li></ol>', 'Sale', 'public/media/user_property/1668677074322413.jpg', 'public/media/user_property/1668677095298073.jpg', 'public/media/user_property/1668677117568565.jpg', 1, 'BW-681239', 'https://www.google.com/maps/embed?pb=!1m18!1m12!1m3!1d117796.67487327367!2d89.68140895703026!3d22.685604916631824!2m3!1f0!2f0!3f0!3m2!1i1024!2i768!4f13.1!3m3!1m2!1s0x39fff43dbdfc0fb3%3A0x9606f07a6d8041e6!2sBagerhat%20Sadar%20Upazila!5e0!3m2!1sen!2sbd!4v1605686008854!5m2!1sen!2sbd', '12-04-20', 'April', '2020', NULL, NULL, NULL, '2020-05-11 19:02:35', '2020-05-11 19:02:35'),
(23, NULL, 4, 30, 'Arshad UL Alam', 'arshad@gmail.com', '01811315472', 'Bahir Signal, 4 No Nondon Kanon Ward', 'Phultala', 5, 2, 1, 'Flat', 1, '1,316 sqft', '26,000', NULL, '26000', 'Bachelor', '2nd', '<ol><li>Considering a suitable lifestyle, this is one of the best places to reside in. It is wonderful and comfortable flat for a family to move in. The respective unit welcomes with a great floor plan. </li><li>The flat has got amazing bedrooms with modish tiled flooring. All the washrooms are finished with the quality and durable fixtures. You will have an apt kitchen area to have your desired cookery essentials. </li><li>A great number of groceries, school, colleges and bus stops are also located in the nearby area.&nbsp;</li><li>This west facing lovely apartment includes 3 large bedrooms and 2 Washrooms With Imported Fittings.</li><li> Here are just a few of its wonderful features: Balcony, 24/7 security service &amp; water, gas available, Tiles Flooring, and so much more!</li></ol><p>&nbsp;&nbsp;&nbsp;&nbsp;&nbsp;&nbsp;&nbsp;&nbsp;&nbsp;&nbsp;&nbsp;&nbsp;- Dont miss this affordable offer and we are just a call away to close the deal for you!</p>', 'Rent', 'public/media/user_property/1668676122797442.jpg', 'public/media/user_property/1668676133401242.jpg', 'public/media/user_property/1668676144339966.jpg', 1, 'BW-142782', 'https://www.google.com/maps/embed?pb=!1m18!1m12!1m3!1d3673.232785092322!2d89.46802671491838!3d22.978465884975463!2m3!1f0!2f0!3f0!3m2!1i1024!2i768!4f13.1!3m3!1m2!1s0x39ff9f4a3b0be6fd%3A0xd1569ec9939a46d4!2sPhultala%20M.M.%20College!5e0!3m2!1sen!2sbd!4v1605686081246!5m2!1sen!2sbd', '12-05-20', 'May', '2020', NULL, NULL, 'admin', '2020-05-12 07:56:56', '2020-05-12 07:56:56'),
(24, NULL, 4, 31, 'Shohel Rana', 'shohel@gmail.com', '01736276233', 'West Rupsha, 9 No. North Pahartali Ward,', 'Rupsha', 2, 2, 1, 'Flat', 1, '1,516 sqft', '20,000', '17,000', '17000', 'Sublet', '3rd', '<ol><li>Considering a suitable lifestyle, this is one of the best places to reside in. It is wonderful and comfortable flat for a family to move in. The respective unit welcomes with a great floor plan. </li><li>The flat has got amazing bedrooms with modish tiled flooring. All the washrooms are finished with the quality and durable fixtures. You will have an apt kitchen area to have your desired cookery essentials.</li><li> A great number of groceries, school, colleges and bus stops are also located in the nearby area.</li><li>This west facing lovely apartment includes 3 large bedrooms and 2 Washrooms With Imported Fittings. Here are just a few of its wonderful features: Balcony, 24/7 security service &amp; water, gas available, Tiles Flooring, and so much more!</li></ol><div><br></div><ul><li>We suggest you make up your mind and steal this deal offered at best deal.</li></ul>', 'Rent', 'public/media/user_property/1668675668437195.jpg', 'public/media/user_property/1668675677691945.jpg', 'public/media/user_property/1668675695477636.jpg', 3, 'BW-237224', 'https://www.google.com/maps/embed?pb=!1m18!1m12!1m3!1d58845.5745324158!2d89.58174468063034!3d22.8080803257649!2m3!1f0!2f0!3f0!3m2!1i1024!2i768!4f13.1!3m3!1m2!1s0x39ff9203b1ce5bb1%3A0x17ceb3869c9a314a!2sRupsha%20Upazila!5e0!3m2!1sen!2sbd!4v1605686123558!5m2!1sen!2sbd', '05-07-20', 'July', '2020', NULL, NULL, 'admin', '2020-05-12 08:01:51', '2020-05-12 08:01:51'),
(25, NULL, 4, 32, 'Khorshed Alam', 'khorshed@gmail.com', '01733455325', 'Chand Mia Road, 4 No Terokhanda', 'Terokhada', 18, 15, 2, 'Home', 13, '2,516 sqft', '120,000,000', NULL, '120000000', 'Family', NULL, '<ol><li>Considering a suitable lifestyle, this is one of the best places to reside in. </li><li>It is wonderful and comfortable flat for a family to move in. The respective unit welcomes with a great floor plan. </li><li>The flat has got amazing bedrooms with modish tiled flooring. </li><li>All the washrooms are finished with the quality and durable fixtures. You will have an apt kitchen area to have your desired cookery essentials. </li><li>A great number of groceries, school, colleges and bus stops are also located in the nearby area. </li><li>This west facing lovely apartment includes 3 large bedrooms and 2 Washrooms With Imported Fittings. Here are just a few of its wonderful features: Balcony, 24/7 security service &amp; water, gas available, Tiles Flooring, and so much more!</li></ol><ul><li>- We suggest you make up your mind and steal this deal offered at best deal.</li></ul>', 'Sale', 'public/media/user_property/1668675941978040.jpg', 'public/media/user_property/1668675949153154.jpg', 'public/media/user_property/1668675959782938.jpg', 1, 'BW-366243', 'https://www.google.com/maps/embed?pb=!1m18!1m12!1m3!1d29395.07603690887!2d89.64453202773936!3d22.936062339788464!2m3!1f0!2f0!3f0!3m2!1i1024!2i768!4f13.1!3m3!1m2!1s0x39ff9458a42c4cfb%3A0x34f8a1bd34538a99!2sTerokhada!5e0!3m2!1sen!2sbd!4v1605686182430!5m2!1sen!2sbd', '12-05-20', 'May', '2020', NULL, '12,000', 'admin', '2020-05-12 08:05:54', '2020-05-12 08:05:54'),
(26, NULL, 5, 20, 'Liton Chy', 'liton@gmail.com', '01877675777', 'Shahid Saifuddin Khaled Road, Banaripara', 'Banaripara', 5, 3, 1, 'Flat', 1, '1,216 sqft', '55,000', NULL, '55000', 'Family', '6th', '<ol><li>Considering a suitable lifestyle, this is one of the best places to reside in. It is wonderful and comfortable flat for a family to move in. The respective unit welcomes with a great floor plan. </li><li>he flat has got amazing bedrooms with modish tiled flooring. All the washrooms are finished with the quality and durable fixtures. You will have an apt kitchen area to have your desired cookery essentials. </li><li>A great number of groceries, school, colleges and bus stops are also located in the nearby area. </li><li>This west facing lovely apartment includes 3 large bedrooms and 2 Washrooms With Imported Fittings. Here are just a few of its wonderful features: Balcony, 24/7 security service &amp; water, gas available, Tiles Flooring, and so much more!</li></ol><div><br></div><ul><li>- We suggest you make up your mind and steal this deal offered at best deal.</li></ul>', 'Rent', 'public/media/user_property/1668676356718769.jpg', 'public/media/user_property/1668676366189912.jpg', 'public/media/user_property/1668676375482002.jpg', 1, 'BW-471380', 'https://www.google.com/maps/embed?pb=!1m18!1m12!1m3!1d29429.85101339078!2d90.12801632754649!3d22.77534814502876!2m3!1f0!2f0!3f0!3m2!1i1024!2i768!4f13.1!3m3!1m2!1s0x37554fc328294719%3A0xc3b0376ac7f41c42!2sBanaripara%20Union!5e0!3m2!1sen!2sbd!4v1605690585327!5m2!1sen!2sbd', '12-05-20', 'May', '2020', NULL, NULL, 'admin', '2020-05-12 08:10:56', '2020-05-12 08:10:56'),
(27, NULL, 5, 21, 'Ahmed Anam', 'anam@gmail.com', '01734656363', 'Green Valley, Bayazid,Bakerganj', 'Bakerganj', 2, 1, 0, 'Flat', 1, '1,116 sqft', '18,000', NULL, '18000', 'Sublet', '7th', '<ol><li>Showing by Private Appt or LB. . This meticulously reimagined smart tech enabled home offers a bright open Chef\'s kitchen, Kraftmaid cabinets, Cambria quartz counters and stainless steel appliances.Spacious master bedroom w/ remote controlled recessed lighting, custom walk-in closet and modern bathroom w/ Hansgrohe fixtures. </li><li>Stylish design and high end finishes w/ refinished hardwood floors, LED recessed lights, skylights, new interior paint and Milgard double pane windows.</li><li> Living room features a modern electric fireplace and beautiful display shelving. Lower level has two bedrooms, one bath, family room, wet bar and low maintenance yard. </li><li>New systems include copper pipes, electrical, water heater, furnace, roof, drywall and WIFI enabled 1 car garage door. Close to all the shops, restaurants, excellent schools and parks that Sunset has to offer.</li></ol><div><span style=\"white-space:pre\">		</span></div><ul><li>We suggest you make up your mind and steal this deal offered at best deal.</li></ul>', 'Rent', 'public/media/user_property/1668675629370797.jpg', 'public/media/user_property/1668675636488814.jpg', 'public/media/user_property/1668675647690213.jpg', 1, 'BW-188604', 'https://www.google.com/maps/embed?pb=!1m18!1m12!1m3!1d3685.290973411334!2d90.33842321491012!3d22.530770385204306!2m3!1f0!2f0!3f0!3m2!1i1024!2i768!4f13.1!3m3!1m2!1s0x30aacbccf1916827%3A0xca39a803b0688b08!2sBakerganj%20Helipad!5e0!3m2!1sen!2sbd!4v1605690652649!5m2!1sen!2sbd', '05-07-20', 'May', '2020', NULL, NULL, 'admin', '2020-05-12 08:15:21', '2020-05-12 08:15:21'),
(28, NULL, 5, 22, 'Saber Khan', 'saber@gmail.com', '01827762626', 'West Babugang, 9 No. North pahatali', 'Babuganj', 2, 1, 1, 'Flat', 1, '1,416 sqft', '15000', '14,000', '14000', 'Bachelor', '3rd', '<ol><li>Showing by Private Appt or LB. . This meticulously reimagined smart tech enabled home offers a bright open Chef\'s kitchen, Kraftmaid cabinets, Cambria quartz counters and stainless steel appliances.Spacious master bedroom w/ remote controlled recessed lighting, custom walk-in closet and modern bathroom w/ Hansgrohe fixtures. </li><li>Stylish design and high end finishes w/ refinished hardwood floors,</li><li> LED recessed lights, skylights, new interior paint and Milgard double pane windows.</li><li> Living room features a modern electric fireplace and beautiful display shelving. Lower level has two bedrooms, one bath, family room, wet bar and low maintenance yard. New systems include copper pipes, electrical, water heater, furnace, roof, drywall and WIFI enabled 1 car garage door. </li><li>Close to all the shops, restaurants, excellent schools and parks that Sunset has to offer.</li></ol><div><span style=\"white-space:pre\">		</span></div><ul><li>- We suggest you make up your mind and steal this deal offered at best deal.</li></ul>', 'Rent', 'public/media/user_property/1668677173100480.jpg', 'public/media/user_property/1668677183381644.jpg', 'public/media/user_property/1668677192972699.jpg', 1, 'BW-724437', 'https://www.google.com/maps/embed?pb=!1m18!1m12!1m3!1d3677.5246127927235!2d90.32277171491545!3d22.820072485055967!2m3!1f0!2f0!3f0!3m2!1i1024!2i768!4f13.1!3m3!1m2!1s0x37553824e50669c9%3A0x2adcd0012f8c2379!2sBabuganj%20Thana%20Jame%20Mosque!5e0!3m2!1sen!2sbd!4v1605690706210!5m2!1sen!2sbd', '12-05-20', 'May', '2020', NULL, NULL, 'admin', '2020-05-12 08:18:39', '2020-05-12 08:18:39');
INSERT INTO `user_properties` (`id`, `user_id`, `city_id`, `subcity_id`, `name`, `email`, `phone`, `address`, `subcity`, `bedroom`, `bathroom`, `parking`, `type`, `kitchen`, `area`, `price`, `discount_price`, `total_price`, `category`, `floor`, `details`, `purpose`, `image_one`, `image_two`, `image_three`, `status`, `property_code`, `map_link`, `date`, `month`, `year`, `hot_new`, `service_charge`, `added_by`, `created_at`, `updated_at`) VALUES
(29, NULL, 6, 33, 'Rumel Hossen', 'rumel@gmail.com', '01833455325', '3 No. Panchlaish Ward, CM avenue', 'Osmani Nagar', 6, 5, 1, 'Flat', 1, '1,316 sqft', '55,000', NULL, '55000', 'Family', '7th', '<ol><li>Considering a suitable lifestyle, this is one of the best places to reside in. It is wonderful and comfortable flat for a family to move in. The respective unit welcomes with a great floor plan. </li><li>The flat has got amazing bedrooms with modish tiled flooring. All the washrooms are finished with the quality and durable fixtures. You will have an apt kitchen area to have your desired cookery essentials.</li><li> A great number of groceries, school, colleges and bus stops are also located in the nearby area. This west facing lovely apartment includes 3 large bedrooms and 2 Washrooms With Imported Fittings. Here are just a few of its wonderful features: Balcony, 24/7 security service &amp; water, gas available, Tiles Flooring, and so much more!</li><li>All the washrooms are finished with the quality and durable fixtures.</li><li> You will have an apt kitchen area to have your desired cookery essentials. A great number of groceries, school, colleges and bus stops are also located in the nearby area.&nbsp;<br></li></ol><div><br></div><ul><li>- We suggest you make up your mind and steal this deal offered at best deal.</li></ul>', 'Rent', 'public/media/user_property/1668688633873512.jpg', 'public/media/user_property/1668688642885586.jpg', 'public/media/user_property/1668688657572954.jpg', 1, 'BW-819900', 'https://www.google.com/maps/embed?pb=!1m18!1m12!1m3!1d3623.797879719998!2d91.7671556149524!3d24.73381838411366!2m3!1f0!2f0!3f0!3m2!1i1024!2i768!4f13.1!3m3!1m2!1s0x375107f2ddcd5c25%3A0x90a57de0862a48e4!2sOsmaninagar%20Zonal%20Office%2C%20Sylhet%20Palli%20Bidyut%20Samity-1!5e0!3m2!1sen!2sbd!4v1605690763468!5m2!1sen!2sbd', '12-05-20', 'May', '2020', NULL, NULL, 'admin', '2020-05-12 11:10:19', '2020-05-12 11:10:19'),
(30, NULL, 6, 34, 'Umar Akmal', 'Omar@gmail.com', '01734656363', 'Satmasjid Road, Sadar Bazar', 'Sylhet Sadar', 5, 3, 1, 'Flat', 1, '1,616 sqft', '30,000', NULL, '30000', 'Bachelor', '3rd', '<div><ol><li>Considering a suitable lifestyle, this is one of the best places to reside in. It is wonderful and comfortable flat for a family to move in. The respective unit welcomes with a great floor plan.</li><li> The flat has got amazing bedrooms with modish tiled flooring. All the washrooms are finished with the quality and durable fixtures. You will have an apt kitchen area to have your desired cookery essentials. </li><li>A great number of groceries, school, colleges and bus stops are also located in the nearby area.&nbsp;</li><li>This west facing lovely apartment includes 3 large bedrooms and 2 Washrooms With Imported Fittings. </li><li>Here are just a few of its wonderful features: Balcony, 24/7 security service &amp; water, gas available, Tiles Flooring, and so much more!</li></ol><div><br></div><ul><li>- We suggest you make up your mind and steal this deal offered at best deal.</li></ul></div>', 'Rent', 'public/media/user_property/1668676272323103.jpg', 'public/media/user_property/1668676279739815.jpg', 'public/media/user_property/1668676291092356.jpg', 3, 'BW-463561', 'https://www.google.com/maps/embed?pb=!1m18!1m12!1m3!1d3618.634285251938!2d91.92875801495597!3d24.91045328403046!2m3!1f0!2f0!3f0!3m2!1i1024!2i768!4f13.1!3m3!1m2!1s0x3750533f3991063d%3A0x6933c81dced69490!2sSylhet%20Sadar%20Upazila%20Office!5e0!3m2!1sen!2sbd!4v1605690826871!5m2!1sen!2sbd', '05-10-20', 'October', '2020', NULL, NULL, 'admin', '2020-05-12 11:13:51', '2020-05-12 11:13:51'),
(31, NULL, 6, 35, 'Yousuf Ahmed', 'yousuf@gmail.com', '0183457325', '4no Bahir Signal, Chandgaon', 'Kanaighat', 2, 1, 0, 'Flat', 1, '1,116 sqft', '14,000', '13,000', '13000', 'Sublet', '7th', '<ol><li>A beautiful, well ventilated and open flat is ready to move in the amicable locality of Mirpur. </li><li>To make sure you are gratified with the home that has always been pictured in your mind, we have enlisted the image of this flat below. </li><li>Utilities are readily available in this apartment.&nbsp; There are balconies to make your apartment life more comfortable in the flat.&nbsp;</li><li>This flat for sale is completed with a great floor plan. </li><li>The balconies would refill the happy time with your family after a hectic day from the daily chores. </li><li>Water, gas &amp; electricity supply is also available for this flat.</li><li>All the washrooms are finished with the quality and durable fixtures. </li><li>You will have an apt kitchen area to have your desired cookery essentials. </li><li>A great number of groceries, school, colleges and bus stops are also located in the nearby area.&nbsp;<br></li></ol><div><br></div><ul><li>&nbsp;Make yourself a happy buyer by calling us about this beautiful apartment right away!</li></ul>', 'Rent', 'public/media/user_property/1668675590213167.jpg', 'public/media/user_property/1668675597544913.jpg', 'public/media/user_property/1668675608026821.jpg', 2, 'BW-182691', 'https://www.google.com/maps/embed?pb=!1m18!1m12!1m3!1d3615.5645039080205!2d92.25486301495806!3d25.0149098839814!2m3!1f0!2f0!3f0!3m2!1i1024!2i768!4f13.1!3m3!1m2!1s0x3750310f20fe24c3%3A0x14aaf752716e9054!2sKanaighat%20College!5e0!3m2!1sen!2sbd!4v1605690877155!5m2!1sen!2sbd', '12-05-20', 'May', '2020', NULL, '1,000', 'admin', '2020-05-12 11:18:25', '2020-05-12 11:18:25'),
(32, NULL, 7, 36, 'Khaledul Alam', 'khaled@gmail.com', '01826562626', '3no Road, CDA Residential Area', 'Nangalkot', 3, 2, 0, 'Flat', 1, '1,316 sqft', '17,000', NULL, '17000', 'Sublet', '3rd', '<ol><li>Considering a suitable lifestyle, this is one of the best places to reside in. It is wonderful and comfortable flat for a family to move in. The respective unit welcomes with a great floor plan. The flat has got amazing bedrooms with modish tiled flooring. </li><li>All the washrooms are finished with the quality and durable fixtures. You will have an apt kitchen area to have your desired cookery essentials.</li><li> A great number of groceries, school, colleges and bus stops are also located in the nearby area.&nbsp;</li><li>This west facing lovely apartment includes 3 large bedrooms and 2 Washrooms With Imported Fittings.</li><li> Here are just a few of its wonderful features: Balcony, 24/7 security service &amp; water, gas available, Tiles Flooring, and so much more!</li><li>All the washrooms are finished with the quality and durable fixtures. </li><li>You will have an apt kitchen area to have your desired cookery essentials. A great number of groceries, school, colleges and bus stops are also located in the nearby area.&nbsp;<br></li></ol>', 'Rent', 'public/media/user_property/1668676976981896.jpg', 'public/media/user_property/1668676985234655.jpg', 'public/media/user_property/1668676995121187.jpg', 1, 'BW-632756', 'https://www.google.com/maps/embed?pb=!1m18!1m12!1m3!1d3659.960757163245!2d91.18472231492753!3d23.461879984732356!2m3!1f0!2f0!3f0!3m2!1i1024!2i768!4f13.1!3m3!1m2!1s0x37547f30a2a09365%3A0xf8a7cb26cbb54b8f!2sNangalkot%20Upazila%20Complex!5e0!3m2!1sen!2sbd!4v1605690926291!5m2!1sen!2sbd', '12-05-20', 'May', '2020', NULL, NULL, 'admin', '2020-05-12 15:58:41', '2020-05-12 15:58:41'),
(33, NULL, 1, 10, 'Anisul Islalm', 'anis@gmail.com', '01829374635', '8 no road, Prosanti Residential Area', 'A K Khan', 4, 3, 1, 'Flat', 1, '1,516 sqft', '30,000', NULL, '30000', 'Family', '7th', '<ol><li>A highly desirable enclosed tunnel entry home offers 3 bedrooms 2 baths on the top floor.</li><li>Spacious master bedroom w/ remote controlled recessed lighting, custom walk-in closet and modern bathroom w/ Hansgrohe fixtures.</li><li>Stylish design and high end finishes w/ refinished hardwood floors, LED recessed lights, skylights, new interior paint and Milgard double pane windows. Living room features a modern electric fireplace and beautiful display shelving. Lower level has two bedrooms, one bath, family room, wet bar and low maintenance yard.</li><li>New systems include copper pipes, electrical, water heater, furnace, roof, drywall and WIFI enabled 1 car garage door. Close to all the shops, restaurants, excellent schools and parks that Sunset has to offer.</li><li>This place is very spacious and constructive. It is just a few minutes away from shopping, dining and local transport.</li><li> We think a lot of crucial facts while we think about getting new home space in a new location. This place is giving you all these benefits along with good privacy and all-time utility supplies. </li><li>So what are you waiting for come and check this vacant space by yourself? We are quite sure you will find how a valuable place it can be for you.</li></ol><p></p><ul><li>- We suggest to make up your mind and steal this deal.</li></ul>', 'Rent', 'public/media/user_property/1668675804917079.jpg', 'public/media/user_property/1668675817068329.jpg', 'public/media/user_property/1668675828075669.jpg', 1, 'BW-290203', 'https://www.google.com/maps/embed?pb=!1m18!1m12!1m3!1d3689.5951356996193!2d91.77559951490711!3d22.368911085287937!2m3!1f0!2f0!3f0!3m2!1i1024!2i768!4f13.1!3m3!1m2!1s0x30acd90a2c5c4ca5%3A0xf89baf1b9b15d610!2sColonel%20Hat%20Foot%20Overbridge%2C%20Chittagong!5e0!3m2!1sen!2sbd!4v1605684022960!5m2!1sen!2sbd', '13-05-20', 'May', '2020', 1, NULL, 'admin', '2020-05-13 10:37:50', '2020-05-13 10:37:50'),
(34, NULL, 7, 37, 'Hossain Alam', 'hossain@gmail.com', '01811456112', '4 No Road, West Sherpara, Kadalpur', 'Lalmai', 5, 3, 1, 'Home', 2, '1,566 sqft', '37,000', NULL, '37000', 'Family', '3rd', '<ol><li>A highly desirable enclosed tunnel entry home offers 3 bedrooms 2 baths on the top floor.</li><li>Spacious master bedroom w/ remote controlled recessed lighting, custom walk-in closet and modern bathroom w/ Hansgrohe fixtures.</li><li>Stylish design and high end finishes w/ refinished hardwood floors, LED recessed lights, skylights, new interior paint and Milgard double pane windows. </li><li>Living room features a modern electric fireplace and beautiful display shelving. Lower level has two bedrooms, one bath, family room, wet bar and low maintenance yard.</li><li>New systems include copper pipes, electrical, water heater, furnace, roof, drywall and WIFI enabled 1 car garage door.</li><li> Close to all the shops, restaurants, excellent schools and parks that Sunset has to offer.</li><li>This place is very spacious and constructive. It is just a few minutes away from shopping, dining and local transport.</li><li>We think a lot of crucial facts while we think about getting new home space in a new location. This place is giving you all these benefits along with good privacy and all-time utility supplies.</li><li>So what are you waiting for come and check this vacant space by yourself? We are quite sure you will find how a valuable place it can be for you.</li></ol><div><br></div><ul><li>- We suggest to make up your mind and steal this deal.</li></ul>', 'Rent', 'public/media/user_property/1668675159393553.jpg', 'public/media/user_property/1668675170840986.jpg', 'public/media/user_property/1668675182423959.jpg', 4, 'BW-471795', 'https://www.google.com/maps/embed?pb=!1m18!1m12!1m3!1d3660.024773027686!2d91.17595981492747!3d23.459570884733584!2m3!1f0!2f0!3f0!3m2!1i1024!2i768!4f13.1!3m3!1m2!1s0x37547f26739b28c1%3A0x7c80529704d0dc59!2sLalmai%20Sanitary%20and%20Tiles!5e0!3m2!1sen!2sbd!4v1605690978143!5m2!1sen!2sbd', '13-05-20', 'May', '2020', NULL, NULL, 'admin', '2020-05-13 10:54:36', '2020-05-13 10:54:36'),
(35, NULL, 7, 38, 'Jamil Uddin', 'jamil@gmail.com', '01878747877', '102.A.D, Town Hill', 'Laksam', 13, 8, 1, 'Home', 5, '2,116 sqft', '150,000,000', NULL, '150000000', 'Family', NULL, '<ol><li>A highly desirable enclosed tunnel entry home offers 3 bedrooms 2 baths on the top floor.</li><li>Spacious master bedroom w/ remote controlled recessed lighting, custom walk-in closet and modern bathroom w/ Hansgrohe fixtures.</li><li>Stylish design and high end finishes w/ refinished hardwood floors, LED recessed lights, skylights, new interior paint and Milgard double pane windows. Living room features a modern electric fireplace and beautiful display shelving. Lower level has two bedrooms, one bath, family room, wet bar and low maintenance yard.</li><li>New systems include copper pipes, electrical, water heater, furnace, roof, drywall and WIFI enabled 1 car garage door. Close to all the shops, restaurants, excellent schools and parks that Sunset has to offer.</li><li>This place is very spacious and constructive. It is just a few minutes away from shopping, dining and local transport.</li><li>We think a lot of crucial facts while we think about getting new home space in a new location. This place is giving you all these benefits along with good privacy and all-time utility supplies.</li></ol><div><br></div><ul><li>- So what are you waiting for come and check this vacant space by yourself? We are quite sure you will find how a valuable place it can be for you.</li></ul><ul><li>- We suggest to make up your mind and steal this deal.</li></ul>', 'Sale', 'public/media/user_property/1668674849818013.jpg', 'public/media/user_property/1668674859640972.jpg', 'public/media/user_property/1668674874590999.jpg', 0, 'BW-972095', 'https://www.google.com/maps/embed?pb=!1m18!1m12!1m3!1d3665.683188418452!2d91.12187081492361!3d23.25461298483605!2m3!1f0!2f0!3f0!3m2!1i1024!2i768!4f13.1!3m3!1m2!1s0x3754846dc6410663%3A0xc87c6a7c012e1ed1!2sLaksam%20Railway%20Junction!5e0!3m2!1sen!2sbd!4v1605691034010!5m2!1sen!2sbd', '13-05-20', 'May', '2020', NULL, NULL, 'admin', '2020-05-13 10:59:17', '2020-05-13 10:59:17'),
(36, NULL, 7, 39, 'Jahid Hasan', 'jahid@gmail.com', '01877987777', '5 NO Road, Gohira Nagar R/A', 'Chauddagram', 3, 2, 11, 'Flat', 1, '1,216 sqft', '23,000', NULL, '23500', 'Sublet', '3rd', '<ol><li>A highly desirable enclosed tunnel entry home offers 3 bedrooms 2 baths on the top floor.</li><li>Spacious master bedroom w/ remote controlled recessed lighting, custom walk-in closet and modern bathroom w/ Hansgrohe fixtures.</li><li>Stylish design and high end finishes w/ refinished hardwood floors, LED recessed lights, skylights, new interior paint and Milgard double pane windows. Living room features a modern electric fireplace and beautiful display shelving. Lower level has two bedrooms, one bath, family room, wet bar and low maintenance yard.</li><li>New systems include copper pipes, electrical, water heater, furnace, roof, drywall and WIFI enabled 1 car garage door. Close to all the shops, restaurants, excellent schools and parks that Sunset has to offer.</li><li>This place is very spacious and constructive. It is just a few minutes away from shopping, dining and local transport.</li><li>We think a lot of crucial facts while we think about getting new home space in a new location. This place is giving you all these benefits along with good privacy and all-time utility supplies.</li></ol><ul><li>- So what are you waiting for come and check this vacant space by yourself? We are quite sure you will find how a valuable place it can be for you.</li></ul><ul><li>- We suggest to make up your mind and steal this deal.</li></ul>', 'Rent', 'public/media/user_property/1668654518493647.jpg', 'public/media/user_property/1668674709753588.jpg', 'public/media/user_property/1668674729927839.jpg', 1, 'BW-195660', 'https://www.google.com/maps/embed?pb=!1m18!1m12!1m3!1d3666.2818902111385!2d91.3101578149232!3d23.23282708484701!2m3!1f0!2f0!3f0!3m2!1i1024!2i768!4f13.1!3m3!1m2!1s0x37537bb92c52ed01%3A0xea0adbad6da834cc!2sUpazila%20Parishad%20Chowddagram!5e0!3m2!1sen!2sbd!4v1605691128331!5m2!1sen!2sbd', '05-07-20', 'May', '2020', NULL, '500', 'admin', '2020-05-13 11:03:09', '2020-05-13 11:03:09'),
(37, 2, 8, 17, 'Amir Khan', 'amir@gmail.com', '01826782626', '8 no road, Jorarbag Residential Area', 'Rangpur Sadar', 3, 2, 1, 'Flat', 1, '1,236 sqft', '15,000', NULL, '15000', 'Bachelor', '3rd', '<ol><li>Considering a suitable lifestyle, this is one of the best places to reside in.</li><li>It is wonderful and comfortable flat for a family to move in.</li><li>The respective unit welcomes with a great floor plan.</li><li>The flat has got amazing bedrooms with modish tiled flooring.</li><li>All the washrooms are finished with the quality and durable fixtures.</li><li>You will have an apt kitchen area to have your desired cookery essentials.</li><li>A great number of groceries, school, colleges and bus stops are also located in the nearby area.&nbsp;</li><li>This flat for sale is completed with a great floor plan.</li><li>The balconies would refill the happy time with your family after a hectic day from the daily chores.</li><li>Water, gas &amp; electricity supply is also available for this flat.&nbsp;</li></ol><ul><li><span style=\"font-size: 0.875rem;\">- Call our agent to be the first and book this flat before anyone else!</span></li></ul>', 'Rent', 'public/media/user_property/1668676417954395.jpg', 'public/media/user_property/1668676431189024.jpg', 'public/media/user_property/1668676442154968.jpg', 1, 'BW-472694', 'https://www.google.com/maps/embed?pb=!1m18!1m12!1m3!1d3592.896647836093!2d89.21953381497369!3d25.773977083631202!2m3!1f0!2f0!3f0!3m2!1i1024!2i768!4f13.1!3m3!1m2!1s0x39e331ac494e2f55%3A0x29cdaf34872a1ef5!2sRangpur%20Sadar%20Upazila%20Eidgah!5e0!3m2!1sen!2sbd!4v1605691187907!5m2!1sen!2sbd', '15-05-20', 'May', '2020', NULL, NULL, NULL, '2020-05-15 10:43:00', '2020-05-15 10:43:00'),
(38, NULL, 8, 18, 'Afif Hossain', 'afif@gmail.com', '01878477798', '7 no road, Onnonna Residential Area', 'Kaunia', 5, 3, 1, 'Flat', 1, '1,566 sqft', '35,000', NULL, '35000', 'Family', '3rd', '<ol><li>Considering a suitable lifestyle, this is one of the best places to reside in. It is wonderful and comfortable flat for a family to move in.</li><li> The respective unit welcomes with a great floor plan. The flat has got amazing bedrooms with modish tiled flooring. </li><li>All the washrooms are finished with the quality and durable fixtures. You will have an apt kitchen area to have your desired cookery essentials.</li><li> A great number of groceries, school, colleges and bus stops are also located in the nearby area. </li><li>This west facing lovely apartment includes 3 large bedrooms and 2 Washrooms With Imported Fittings. Here are just a few of its wonderful features: Balcony, 24/7 security service &amp; water, gas available, Tiles Flooring, and so much more!</li></ol><div><br></div><ul><li>We suggest you make up your mind and steal this deal offered at best deal.</li></ul>', 'Rent', 'public/media/user_property/1668674753279941.jpg', 'public/media/user_property/1668674766782260.jpg', 'public/media/user_property/1668674781016277.jpg', 0, 'BW-943929', 'https://www.google.com/maps/embed?pb=!1m18!1m12!1m3!1d3592.879533946389!2d89.41281081497368!3d25.774542283630886!2m3!1f0!2f0!3f0!3m2!1i1024!2i768!4f13.1!3m3!1m2!1s0x39e2d6147dc6998f%3A0x2b98e3796128178!2sKaunia%20College!5e0!3m2!1sen!2sbd!4v1605691242911!5m2!1sen!2sbd', '05-07-20', 'May', '2020', NULL, NULL, 'admin', '2020-05-15 11:46:08', '2020-05-15 11:46:08'),
(39, NULL, 8, 19, 'Tamim Chowdhury', 'tamim@gmail.com', '01847862626', '3 No Road, Shanti Nagar R/A, Shanti Nogor', 'Gangachhara', 6, 4, 1, 'Flat', 1, '1,876 sqft', '55,000', NULL, '55000', 'Family', '5th', '<ol><li>A highly desirable enclosed tunnel entry home offers 3 bedrooms 2 baths on the top floor.</li><li>Spacious master bedroom w/ remote controlled recessed lighting, custom walk-in closet and modern bathroom w/ Hansgrohe fixtures.</li><li>Stylish design and high end finishes w/ refinished hardwood floors, LED recessed lights, skylights, new interior paint and Milgard double pane windows. Living room features a modern electric fireplace and beautiful display shelving. Lower level has two bedrooms, one bath, family room, wet bar and low maintenance yard.</li><li>New systems include copper pipes, electrical, water heater, furnace, roof, drywall and WIFI enabled 1 car garage door. Close to all the shops, restaurants, excellent schools and parks that Sunset has to offer.</li><li>This place is very spacious and constructive. It is just a few minutes away from shopping, dining and local transport.</li><li>We think a lot of crucial facts while we think about getting new home space in a new location. This place is giving you all these benefits along with good privacy and all-time utility supplies.</li></ol><ul><li>- So what are you waiting for come and check this vacant space by yourself? We are quite sure you will find how a valuable place it can be for you.</li></ul><ul><li>- We suggest to make up your mind and steal this deal.</li></ul>', 'Rent', 'public/media/user_property/1668676932436953.jpg', 'public/media/user_property/1668676941313673.jpg', 'public/media/user_property/1668676949160564.jpg', 1, 'BW-626017', 'https://www.google.com/maps/embed?pb=!1m18!1m12!1m3!1d3590.458150880238!2d89.21447181497534!3d25.854394383594773!2m3!1f0!2f0!3f0!3m2!1i1024!2i768!4f13.1!3m3!1m2!1s0x39e33a83136f2df5%3A0xc64b16af85f31d89!2sGangachara%20Mohila%20Degree%20College!5e0!3m2!1sen!2sbd!4v1605691300371!5m2!1sen!2sbd', '15-05-20', 'May', '2020', NULL, NULL, 'admin', '2020-05-15 15:35:08', '2020-05-15 15:35:08'),
(40, NULL, 2, 12, 'Irfan Hasan', 'irfan5@gmail.com', '01877766677', '12 No Prosanti R/a', 'Mirpur', 5, 2, 1, 'Flat', 1, '1,216 sqft', '8,900,000', NULL, '8900000', 'Family', '5th', '<ol><li>Considering a suitable lifestyle, this is one of the best places to reside in. It is wonderful and comfortable flat for a family to move in. </li><li>The respective unit welcomes with a great floor plan. The flat has got amazing bedrooms with modish tiled flooring. </li><li>All the washrooms are finished with the quality and durable fixtures. You will have an apt kitchen area to have your desired cookery essentials. </li><li>A great number of groceries, school, colleges and bus stops are also located in the nearby area. </li><li>This west facing lovely apartment includes 3 large bedrooms and 2 Washrooms With Imported Fittings. </li><li>Here are just a few of its wonderful features: Balcony, 24/7 security service &amp; water, gas available, Tiles Flooring, and so much more!</li></ol><div><br></div><ul><li>- We suggest you make up your mind and steal this deal offered at best deal.</li></ul>', 'Sale', 'public/media/user_property/1668688742726367.jpg', 'public/media/user_property/1668688761904714.jpg', 'public/media/user_property/1668688776198974.jpg', 1, 'BW-846585', 'https://www.google.com/maps/embed?pb=!1m18!1m12!1m3!1d14602.702518325506!2d90.34510367960334!3d23.794562453080236!2m3!1f0!2f0!3f0!3m2!1i1024!2i768!4f13.1!3m3!1m2!1s0x3755c0e96fce29dd%3A0x6ccd9e51aba9e64d!2sMirpur-1%2C%20Dhaka!5e0!3m2!1sen!2sbd!4v1605684727327!5m2!1sen!2sbd', '01-06-20', 'June', '2020', NULL, NULL, 'admin', '2020-06-01 20:44:52', '2020-06-01 20:44:52'),
